ID (num probes:22690)	adj.P.Val	P.Value	t	B	logFC	Gene.symbol	Gene.title	Gene.ID	Chromosome.location	GO.Function	GO.Process	GO.Component	GO.Function.ID	GO.Process.ID	GO.Component.ID
1449465_at	0.842293789711849	0.377159319563749	0.940221542758081	-5.60470415158405	0.112817510020326	Reln	reelin	19699	5 9.98 cM	hydrolase activity///lipoprotein particle receptor binding///metal ion binding///peptidase activity///protein binding///serine-type peptidase activity///very-low-density lipoprotein particle receptor binding	N-methyl-D-aspartate receptor clustering///associative learning///axon guidance///brain development///brain development///cell adhesion///cell migration///cell morphogenesis involved in differentiation///central nervous system development///cerebral cortex development///cerebral cortex tangential migration///dendrite development///dendrite development///dentate gyrus development///forebrain development///glial cell differentiation///hippocampus development///lateral motor column neuron migration///layer formation in cerebral cortex///locomotory behavior///locomotory behavior///long-term memory///multicellular organismal development///neuron migration///neuron migration///neuron migration///peptidyl-tyrosine phosphorylation///positive regulation of CREB transcription factor activity///positive regulation of TOR signaling///positive regulation of alpha-amino-3-hydroxy-5-methyl-4-isoxazole propionate selective glutamate receptor activity///positive regulation of dendritic spine morphogenesis///positive regulation of dendritic spine morphogenesis///positive regulation of excitatory postsynaptic membrane potential///positive regulation of excitatory postsynaptic membrane potential///positive regulation of lateral motor column neuron migration///positive regulation of long-term synaptic potentiation///positive regulation of neuron projection development///positive regulation of peptidyl-tyrosine phosphorylation///positive regulation of phosphatidylinositol 3-kinase signaling///positive regulation of protein kinase activity///positive regulation of protein kinase activity///positive regulation of protein tyrosine kinase activity///positive regulation of small GTPase mediated signal transduction///positive regulation of synapse maturation///positive regulation of synaptic transmission, glutamatergic///positive regulation of synaptic transmission, glutamatergic///postsynaptic density assembly///postsynaptic density protein 95 clustering///protein localization to synapse///proteolysis///receptor localization to synapse///reelin-mediated signaling pathway///regulation of N-methyl-D-aspartate selective glutamate receptor activity///regulation of behavior///regulation of gene expression///regulation of synaptic transmission///response to pain///spinal cord patterning///thyroid hormone metabolic process	axon///cytoplasm///cytoplasm///dendrite///dendrite///extracellular region///extracellular space///extracellular space///neuron projection///neuronal cell body///perikaryon///proteinaceous extracellular matrix	GO:0016787///GO:0070325///GO:0046872///GO:0008233///GO:0005515///GO:0008236///GO:0070326	GO:0097114///GO:0008306///GO:0007411///GO:0007420///GO:0007420///GO:0007155///GO:0016477///GO:0000904///GO:0007417///GO:0021987///GO:0021800///GO:0016358///GO:0016358///GO:0021542///GO:0030900///GO:0010001///GO:0021766///GO:0097477///GO:0021819///GO:0007626///GO:0007626///GO:0007616///GO:0007275///GO:0001764///GO:0001764///GO:0001764///GO:0018108///GO:0032793///GO:0032008///GO:2000969///GO:0061003///GO:0061003///GO:2000463///GO:2000463///GO:1902078///GO:1900273///GO:0010976///GO:0050731///GO:0014068///GO:0045860///GO:0045860///GO:0061098///GO:0051057///GO:0090129///GO:0051968///GO:0051968///GO:0097107///GO:0097119///GO:0035418///GO:0006508///GO:0097120///GO:0038026///GO:2000310///GO:0050795///GO:0010468///GO:0050804///GO:0048265///GO:0021511///GO:0042403	GO:0030424///GO:0005737///GO:0005737///GO:0030425///GO:0030425///GO:0005576///GO:0005615///GO:0005615///GO:0043005///GO:0043025///GO:0043204///GO:0005578
1435859_x_at	0.845757210943027	0.386038040991448	0.921878670866728	-5.62101321802809	0.213672020454663	Psmc2	proteasome (prosome, macropain) 26S subunit, ATPase 2	19181	5 9.97 cM	ATP binding///ATPase activity///TBP-class protein binding///hydrolase activity///nucleotide binding///protein binding	ATP catabolic process///osteoblast differentiation///protein catabolic process///ubiquitin-dependent protein catabolic process	cytoplasm///cytoplasmic mRNA processing body///membrane///nucleus///proteasome accessory complex///proteasome complex	GO:0005524///GO:0016887///GO:0017025///GO:0016787///GO:0000166///GO:0005515	GO:0006200///GO:0001649///GO:0030163///GO:0006511	GO:0005737///GO:0000932///GO:0016020///GO:0005634///GO:0022624///GO:0000502
1423303_at	0.849412561391899	0.392436839183397	0.908852605483629	-5.63244289291406	0.140303612074307	Paxip1	PAX interacting (with transcription-activation domain) protein 1	55982	5 13.23 cM	protein binding	DNA recombination///DNA repair///adipose tissue development///cellular response to DNA damage stimulus///chorion development///endothelial cell migration///positive regulation of histone H3-K36 methylation///positive regulation of histone H3-K4 methylation///positive regulation of histone acetylation///positive regulation of isotype switching///positive regulation of protein ubiquitination///positive regulation of transcription initiation from RNA polymerase II promoter///regulation of transcription, DNA-templated///transcription, DNA-templated///vasculogenesis	histone methyltransferase complex///nucleus	GO:0005515	GO:0006310///GO:0006281///GO:0060612///GO:0006974///GO:0060717///GO:0043542///GO:0000416///GO:0051571///GO:0035066///GO:0045830///GO:0031398///GO:0060261///GO:0006355///GO:0006351///GO:0001570	GO:0035097///GO:0005634
1433729_x_at	0.852829811508261	0.397778396822138	-0.898098189061391	-5.64178305981961	-0.073829243025747	Pmpcb	peptidase (mitochondrial processing) beta	73078	5	catalytic activity///hydrolase activity///metal ion binding///metalloendopeptidase activity///metallopeptidase activity///peptidase activity	proteolysis	mitochondrial inner membrane///mitochondrion///mitochondrion	GO:0003824///GO:0016787///GO:0046872///GO:0004222///GO:0008237///GO:0008233	GO:0006508	GO:0005743///GO:0005739///GO:0005739
1428439_at	0.85524790981235	0.400221344486008	0.893214964582309	-5.64599516418937	0.0593692765330793	Nub1	negative regulator of ubiquitin-like proteins 1	53312	5	molecular_function	positive regulation of proteasomal ubiquitin-dependent protein catabolic process///protein ubiquitination///ubiquitin-dependent protein catabolic process	cytoplasm///nucleolus///nucleus	GO:0003674	GO:0032436///GO:0016567///GO:0006511	GO:0005737///GO:0005730///GO:0005634
1423831_at	0.859422453558173	0.411621523122662	0.870709857368286	-5.66517128261083	0.0766735126407347	Prkag2	protein kinase, AMP-activated, gamma 2 non-catalytic subunit	108099	5	ADP binding///AMP binding///contributes_to AMP-activated protein kinase activity///AMP-activated protein kinase activity///ATP binding///cAMP-dependent protein kinase inhibitor activity///cAMP-dependent protein kinase regulator activity///kinase activity///nucleotide binding///phosphorylase kinase regulator activity///protein kinase activator activity///protein kinase binding///transferase activity	fatty acid biosynthetic process///fatty acid metabolic process///glycogen metabolic process///intracellular signal transduction///lipid metabolic process///negative regulation of protein kinase activity///negative regulation of protein serine/threonine kinase activity///phosphorylation///positive regulation of peptidyl-threonine phosphorylation///positive regulation of protein kinase activity///protein phosphorylation///protein phosphorylation///regulation of catalytic activity///regulation of fatty acid metabolic process///regulation of glycolytic process	AMP-activated protein kinase complex///extracellular space	GO:0043531///GO:0016208///contributes_to GO:0004679///GO:0004679///GO:0005524///GO:0004862///GO:0008603///GO:0016301///GO:0000166///GO:0008607///GO:0030295///GO:0019901///GO:0016740	GO:0006633///GO:0006631///GO:0005977///GO:0035556///GO:0006629///GO:0006469///GO:0071901///GO:0016310///GO:0010800///GO:0045860///GO:0006468///GO:0006468///GO:0050790///GO:0019217///GO:0006110	GO:0031588///GO:0005615
1449544_a_at	0.8610931531467	0.414926350502596	-0.864270237265816	-5.67058635621293	-0.142781087135088	Kcnh2	potassium voltage-gated channel, subfamily H (eag-related), member 2	16511	5 10.94 cM	delayed rectifier potassium channel activity///identical protein binding///inward rectifier potassium channel activity///inward rectifier potassium channel activity///ion channel activity///phosphorelay sensor kinase activity///potassium channel activity///protein homodimerization activity///signal transducer activity///ubiquitin protein ligase binding///voltage-gated ion channel activity///voltage-gated potassium channel activity///voltage-gated potassium channel activity///voltage-gated potassium channel activity involved in ventricular cardiac muscle cell action potential repolarization	cardiac muscle contraction///cellular response to drug///ion transport///membrane depolarization during action potential///membrane repolarization during action potential///membrane repolarization during cardiac muscle cell action potential///negative regulation of potassium ion export///negative regulation of potassium ion transmembrane transport///phosphorelay signal transduction system///positive regulation of potassium ion transmembrane transport///potassium ion export///potassium ion homeostasis///potassium ion transmembrane transport///potassium ion transmembrane transport///potassium ion transport///protein heterooligomerization///regulation of heart rate by cardiac conduction///regulation of heart rate by cardiac conduction///regulation of ion transmembrane transport///regulation of membrane potential///regulation of membrane potential///regulation of membrane repolarization///regulation of potassium ion transmembrane transport///regulation of ventricular cardiac muscle cell membrane repolarization///regulation of ventricular cardiac muscle cell membrane repolarization///signal transduction///transmembrane transport///transport///ventricular cardiac muscle cell action potential	cell surface///cytoplasm///integral component of membrane///integral component of plasma membrane///integral component of plasma membrane///membrane///nuclear envelope///plasma membrane///plasma membrane///voltage-gated potassium channel complex	GO:0005251///GO:0042802///GO:0005242///GO:0005242///GO:0005216///GO:0000155///GO:0005267///GO:0042803///GO:0004871///GO:0031625///GO:0005244///GO:0005249///GO:0005249///GO:1902282	GO:0060048///GO:0035690///GO:0006811///GO:0086010///GO:0086011///GO:0086013///GO:1902303///GO:1901380///GO:0000160///GO:1901381///GO:0071435///GO:0055075///GO:0071805///GO:0071805///GO:0006813///GO:0051291///GO:0086091///GO:0086091///GO:0034765///GO:0042391///GO:0042391///GO:0060306///GO:1901379///GO:0060307///GO:0060307///GO:0007165///GO:0055085///GO:0006810///GO:0086005	GO:0009986///GO:0005737///GO:0016021///GO:0005887///GO:0005887///GO:0016020///GO:0005635///GO:0005886///GO:0005886///GO:0008076
1423713_at	0.870301247183883	0.43452150661543	-0.826822193666904	-5.70143110317249	-0.137482958353385	Abcb8	ATP-binding cassette, sub-family B (MDR/TAP), member 8	74610	5	ATP binding///ATPase activity///ATPase activity, coupled to transmembrane movement of substances///nucleotide binding	ATP catabolic process///transmembrane transport///transport	integral component of membrane///membrane///mitochondrial inner membrane///mitochondrion///mitochondrion///nucleolus///nucleus	GO:0005524///GO:0016887///GO:0042626///GO:0000166	GO:0006200///GO:0055085///GO:0006810	GO:0016021///GO:0016020///GO:0005743///GO:0005739///GO:0005739///GO:0005730///GO:0005634
1428091_at	0.870327255076331	0.436426223619011	0.823246282638656	-5.70431819976863	0.178754801456668	Klhl7	kelch-like 7	52323	5 10.67 cM	protein homodimerization activity	protein ubiquitination	Cul3-RING ubiquitin ligase complex///cytoplasm///nucleus///plasma membrane	GO:0042803	GO:0016567	GO:0031463///GO:0005737///GO:0005634///GO:0005886
1416637_at	0.870723329570648	0.43948204579194	-0.817532055770008	-5.70891039511753	-0.0985556182012139	Slc4a2	solute carrier family 4 (anion exchanger), member 2	20535	5 11.74 cM	anion transmembrane transporter activity///anion:anion antiporter activity///antiporter activity///chloride transmembrane transporter activity///inorganic anion exchanger activity///transporter activity	anion transport///chloride transmembrane transport///chloride transport///ion transport///transport	basolateral plasma membrane///basolateral plasma membrane///focal adhesion///integral component of membrane///membrane///membrane	GO:0008509///GO:0015301///GO:0015297///GO:0015108///GO:0005452///GO:0005215	GO:0006820///GO:1902476///GO:0006821///GO:0006811///GO:0006810	GO:0016323///GO:0016323///GO:0005925///GO:0016021///GO:0016020///GO:0016020
1423863_at	0.871100326885657	0.440195519967869	-0.816201896813111	-5.7099755945161	-0.0800298429292194	Abcf2	ATP-binding cassette, sub-family F (GCN20), member 2	27407	5	ATP binding///ATPase activity///nucleotide binding	biological_process	membrane///mitochondrion	GO:0005524///GO:0016887///GO:0000166	GO:0008150	GO:0016020///GO:0005739
1417134_at	0.872405694080755	0.445017477257957	-0.80725125674477	-5.71710613156823	-0.145911919741447	Srpk2	serine/arginine-rich protein specific kinase 2	20817	5 10.36 cM	14-3-3 protein binding///ATP binding///ATP binding///kinase activity///magnesium ion binding///magnesium ion binding///nucleotide binding///poly(A) RNA binding///protein binding///protein kinase activity///protein serine/threonine kinase activity///protein serine/threonine kinase activity///transferase activity///transferase activity, transferring phosphorus-containing groups	RNA splicing///RNA splicing///angiogenesis///cell differentiation///intracellular signal transduction///intracellular signal transduction///mRNA processing///negative regulation of viral genome replication///nuclear speck organization///phosphorylation///positive regulation of cell cycle///positive regulation of cell proliferation///positive regulation of cell proliferation///positive regulation of gene expression///positive regulation of neuron apoptotic process///positive regulation of viral genome replication///protein phosphorylation///protein phosphorylation///spliceosomal complex assembly///spliceosomal complex assembly	cytoplasm///cytoplasm///nucleus///nucleus	GO:0071889///GO:0005524///GO:0005524///GO:0016301///GO:0000287///GO:0000287///GO:0000166///GO:0044822///GO:0005515///GO:0004672///GO:0004674///GO:0004674///GO:0016740///GO:0016772	GO:0008380///GO:0008380///GO:0001525///GO:0030154///GO:0035556///GO:0035556///GO:0006397///GO:0045071///GO:0035063///GO:0016310///GO:0045787///GO:0008284///GO:0008284///GO:0010628///GO:0043525///GO:0045070///GO:0006468///GO:0006468///GO:0000245///GO:0000245	GO:0005737///GO:0005737///GO:0005634///GO:0005634
1425605_a_at	0.887215837230446	0.483216608267134	0.738588052572763	-5.76961366442357	0.0598838161572459	Lmbr1	limb region 1	56873	5 14.81 cM		embryonic digit morphogenesis///embryonic hindlimb morphogenesis	integral component of membrane///membrane		GO:0042733///GO:0035116	GO:0016021///GO:0016020
1450724_at	0.891612415741753	0.493467197310446	0.720784173382169	-5.78258147088702	0.0883097854535499	Fam126a	family with sequence similarity 126, member A	84652	5	molecular_function	biological_process	cytoplasm///membrane///plasma membrane	GO:0003674	GO:0008150	GO:0005737///GO:0016020///GO:0005886
1426522_at	0.891637665986481	0.497491325600846	-0.713860848076714	-5.7875508139852	-0.0395967229004892	Hadhb	hydroxyacyl-Coenzyme A dehydrogenase/3-ketoacyl-Coenzyme A thiolase/enoyl-Coenzyme A hydratase (trifunctional protein), beta subunit	231086	5	3-hydroxyacyl-CoA dehydrogenase activity///NAD binding///acetyl-CoA C-acyltransferase activity///acetyl-CoA C-acyltransferase activity///acetyl-CoA C-acyltransferase activity///catalytic activity///enoyl-CoA hydratase activity///fatty-acyl-CoA binding///long-chain-3-hydroxyacyl-CoA dehydrogenase activity///long-chain-3-hydroxyacyl-CoA dehydrogenase activity///long-chain-enoyl-CoA hydratase activity///poly(A) RNA binding///protein complex binding///transferase activity///transferase activity, transferring acyl groups///transferase activity, transferring acyl groups other than amino-acyl groups	fatty acid beta-oxidation///fatty acid beta-oxidation///fatty acid metabolic process///lipid metabolic process///metabolic process///oxidation-reduction process	endoplasmic reticulum///extracellular vesicular exosome///membrane///mitochondrial fatty acid beta-oxidation multienzyme complex///mitochondrial fatty acid beta-oxidation multienzyme complex///mitochondrial inner membrane///mitochondrial inner membrane///mitochondrial nucleoid///mitochondrial outer membrane///mitochondrion///mitochondrion///mitochondrion///mitochondrion	GO:0003857///GO:0051287///GO:0003988///GO:0003988///GO:0003988///GO:0003824///GO:0004300///GO:0000062///GO:0016509///GO:0016509///GO:0016508///GO:0044822///GO:0032403///GO:0016740///GO:0016746///GO:0016747	GO:0006635///GO:0006635///GO:0006631///GO:0006629///GO:0008152///GO:0055114	GO:0005783///GO:0070062///GO:0016020///GO:0016507///GO:0016507///GO:0005743///GO:0005743///GO:0042645///GO:0005741///GO:0005739///GO:0005739///GO:0005739///GO:0005739
1448603_at	0.891637665986481	0.5002974472978	-0.709054495451885	-5.79097634254612	-0.0733075230902287	Srpk2	serine/arginine-rich protein specific kinase 2	20817	5 10.36 cM	14-3-3 protein binding///ATP binding///ATP binding///kinase activity///magnesium ion binding///magnesium ion binding///nucleotide binding///poly(A) RNA binding///protein binding///protein kinase activity///protein serine/threonine kinase activity///protein serine/threonine kinase activity///transferase activity///transferase activity, transferring phosphorus-containing groups	RNA splicing///RNA splicing///angiogenesis///cell differentiation///intracellular signal transduction///intracellular signal transduction///mRNA processing///negative regulation of viral genome replication///nuclear speck organization///phosphorylation///positive regulation of cell cycle///positive regulation of cell proliferation///positive regulation of cell proliferation///positive regulation of gene expression///positive regulation of neuron apoptotic process///positive regulation of viral genome replication///protein phosphorylation///protein phosphorylation///spliceosomal complex assembly///spliceosomal complex assembly	cytoplasm///cytoplasm///nucleus///nucleus	GO:0071889///GO:0005524///GO:0005524///GO:0016301///GO:0000287///GO:0000287///GO:0000166///GO:0044822///GO:0005515///GO:0004672///GO:0004674///GO:0004674///GO:0016740///GO:0016772	GO:0008380///GO:0008380///GO:0001525///GO:0030154///GO:0035556///GO:0035556///GO:0006397///GO:0045071///GO:0035063///GO:0016310///GO:0045787///GO:0008284///GO:0008284///GO:0010628///GO:0043525///GO:0045070///GO:0006468///GO:0006468///GO:0000245///GO:0000245	GO:0005737///GO:0005737///GO:0005634///GO:0005634
1448203_at	0.891637665986481	0.504422198212887	-0.702021031687707	-5.79595309299911	-0.0568787665150037	Gm10221///Atp5l	ATP synthase, H+ transporting, mitochondrial F0 complex, subunit g pseudogene///ATP synthase, H+ transporting, mitochondrial F0 complex, subunit G	100042348///27425	5///9	contributes_to ATPase activity///hydrogen-exporting ATPase activity, phosphorylative mechanism	ATP catabolic process///ATP catabolic process///ATP metabolic process///ATP synthesis coupled proton transport	extracellular vesicular exosome///mitochondrial inner membrane///mitochondrial proton-transporting ATP synthase complex///mitochondrial proton-transporting ATP synthase complex///mitochondrial proton-transporting ATP synthase complex, coupling factor F(o)///mitochondrion///mitochondrion	contributes_to GO:0016887///GO:0008553	GO:0006200///GO:0006200///GO:0046034///GO:0015986	GO:0070062///GO:0005743///GO:0005753///GO:0005753///GO:0000276///GO:0005739///GO:0005739
1423302_a_at	0.891865440495811	0.507734718430224	-0.696399245285059	-5.79990005047174	-0.0608928688058299	Paxip1	PAX interacting (with transcription-activation domain) protein 1	55982	5 13.23 cM	protein binding	DNA recombination///DNA repair///adipose tissue development///cellular response to DNA damage stimulus///chorion development///endothelial cell migration///positive regulation of histone H3-K36 methylation///positive regulation of histone H3-K4 methylation///positive regulation of histone acetylation///positive regulation of isotype switching///positive regulation of protein ubiquitination///positive regulation of transcription initiation from RNA polymerase II promoter///regulation of transcription, DNA-templated///transcription, DNA-templated///vasculogenesis	histone methyltransferase complex///nucleus	GO:0005515	GO:0006310///GO:0006281///GO:0060612///GO:0006974///GO:0060717///GO:0043542///GO:0000416///GO:0051571///GO:0035066///GO:0045830///GO:0031398///GO:0060261///GO:0006355///GO:0006351///GO:0001570	GO:0035097///GO:0005634
1451394_at	0.89298570211617	0.512994964500665	-0.687519782948514	-5.80607796930674	-0.0469277864329634	Dpp6	dipeptidylpeptidase 6	13483	5 12.92 cM	protein binding///serine-type peptidase activity	neuronal action potential///positive regulation of potassium ion transmembrane transport///positive regulation of potassium ion transport///proteolysis///regulation of membrane potential///regulation of potassium ion transmembrane transport///regulation of potassium ion transport	cell surface///extracellular vesicular exosome///integral component of membrane///membrane///neuronal cell body///voltage-gated potassium channel complex	GO:0005515///GO:0008236	GO:0019228///GO:1901381///GO:0043268///GO:0006508///GO:0042391///GO:1901379///GO:0043266	GO:0009986///GO:0070062///GO:0016021///GO:0016020///GO:0043025///GO:0008076
1429776_a_at	0.894040654857818	0.518806689693242	-0.677776220126963	-5.81277751622202	-0.0643914661767884	Dnajb6	DnaJ (Hsp40) homolog, subfamily B, member 6	23950	5	ATPase activator activity///DNA binding///chaperone binding///heat shock protein binding///protein binding///protein binding involved in protein folding///unfolded protein binding	actin cytoskeleton organization///chaperone-mediated protein folding///chorio-allantoic fusion///chorion development///extracellular matrix organization///intermediate filament organization///negative regulation of cysteine-type endopeptidase activity involved in apoptotic process///negative regulation of inclusion body assembly///negative regulation of transcription, DNA-templated///positive regulation of ATPase activity///protein folding///protein localization to nucleus///syncytiotrophoblast cell differentiation involved in labyrinthine layer development	Z disc///cytoplasm///cytoplasm///cytosol///membrane///nucleus///nucleus///perinuclear region of cytoplasm	GO:0001671///GO:0003677///GO:0051087///GO:0031072///GO:0005515///GO:0044183///GO:0051082	GO:0030036///GO:0061077///GO:0060710///GO:0060717///GO:0030198///GO:0045109///GO:0043154///GO:0090084///GO:0045892///GO:0032781///GO:0006457///GO:0034504///GO:0060715	GO:0030018///GO:0005737///GO:0005737///GO:0005829///GO:0016020///GO:0005634///GO:0005634///GO:0048471
1424889_at	0.896571180502257	0.526935347632048	-0.664262484412396	-5.82193068974535	-0.0364867540245086	Nupl2	nucleoporin like 2	231042	5	metal ion binding///poly(A) RNA binding	mRNA transport///protein transport///transport	membrane///nuclear pore///nucleus	GO:0046872///GO:0044822	GO:0051028///GO:0015031///GO:0006810	GO:0016020///GO:0005643///GO:0005634
1421725_at	0.905440316896696	0.54861143572921	0.628843602465784	-5.84514730283756	0.0776196911885467	Slc26a5	solute carrier family 26, member 5	80979	5 9.97 cM	protein binding///protein homodimerization activity///secondary active sulfate transmembrane transporter activity///spectrin binding///sulfate transmembrane transporter activity///transcription factor binding	anion transmembrane transport///chloride transmembrane transport///protein tetramerization///regulation of cell shape///regulation of membrane potential///sensory perception of sound///sulfate transport///transmembrane transport	basolateral plasma membrane///basolateral plasma membrane///cytoplasm///integral component of membrane///lateral plasma membrane///lateral plasma membrane///membrane///plasma membrane	GO:0005515///GO:0042803///GO:0008271///GO:0030507///GO:0015116///GO:0008134	GO:0098656///GO:1902476///GO:0051262///GO:0008360///GO:0042391///GO:0007605///GO:0008272///GO:0055085	GO:0016323///GO:0016323///GO:0005737///GO:0016021///GO:0016328///GO:0016328///GO:0016020///GO:0005886
1425286_at	0.905911648255162	0.553121086894464	0.621581910712833	-5.84976748274214	0.0950497282910447	Crygn	crystallin, gamma N	214301	5	molecular_function///structural constituent of eye lens	biological_process	cellular_component	GO:0003674///GO:0005212	GO:0008150	GO:0005575
1424748_at	0.910732281232387	0.570058646365155	-0.594616964057071	-5.86650222724702	-0.0637859649059589	Galnt11	UDP-N-acetyl-alpha-D-galactosamine:polypeptide N-acetylgalactosaminyltransferase 11	231050	5	Notch binding///carbohydrate binding///metal ion binding///polypeptide N-acetylgalactosaminyltransferase activity///transferase activity///transferase activity, transferring glycosyl groups	Notch signaling pathway///protein O-linked glycosylation via threonine	Golgi apparatus///cellular_component///integral component of membrane///membrane	GO:0005112///GO:0030246///GO:0046872///GO:0004653///GO:0016740///GO:0016757	GO:0007219///GO:0018243	GO:0005794///GO:0005575///GO:0016021///GO:0016020
