ID (num probes:22690)	adj.P.Val	P.Value	t	B	logFC	Gene.symbol	Gene.title	Gene.ID	Chromosome.location	GO.Function	GO.Process	GO.Component	GO.Function.ID	GO.Process.ID	GO.Component.ID
1453950_a_at	0.755781325673118	0.221239051844561	1.33743116191287	-5.19721119598577	0.076857212746761	Xrcc2	X-ray repair complementing defective repair in Chinese hamster cells 2	57434	5	ATP binding///DNA binding///DNA-dependent ATPase activity///contributes_to four-way junction DNA binding	DNA metabolic process///DNA recombination///DNA repair///cellular response to DNA damage stimulus///centrosome organization///double-strand break repair via homologous recombination///double-strand break repair via homologous recombination///in utero embryonic development///mitotic cell cycle///multicellular organism growth///negative regulation of neuron apoptotic process///neurogenesis///positive regulation of neurogenesis///regulation of fibroblast apoptotic process///response to X-ray///response to gamma radiation///somitogenesis///strand invasion	Rad51B-Rad51C-Rad51D-XRCC2 complex///centrosome///nucleus///replication fork	GO:0005524///GO:0003677///GO:0008094///contributes_to GO:0000400	GO:0006259///GO:0006310///GO:0006281///GO:0006974///GO:0051297///GO:0000724///GO:0000724///GO:0001701///GO:0000278///GO:0035264///GO:0043524///GO:0022008///GO:0050769///GO:2000269///GO:0010165///GO:0010332///GO:0001756///GO:0042148	GO:0033063///GO:0005813///GO:0005634///GO:0005657
1452173_at	0.757191372659234	0.2241241535481	-1.32819289558857	-5.20772102596884	-0.367605586251832	Hadha	hydroxyacyl-Coenzyme A dehydrogenase/3-ketoacyl-Coenzyme A thiolase/enoyl-Coenzyme A hydratase (trifunctional protein), alpha subunit	97212	5	3-hydroxyacyl-CoA dehydrogenase activity///NAD binding///acetyl-CoA C-acyltransferase activity///catalytic activity///coenzyme binding///enoyl-CoA hydratase activity///enoyl-CoA hydratase activity///fatty-acyl-CoA binding///long-chain-3-hydroxyacyl-CoA dehydrogenase activity///long-chain-3-hydroxyacyl-CoA dehydrogenase activity///long-chain-enoyl-CoA hydratase activity///lyase activity///oxidoreductase activity///oxidoreductase activity, acting on the CH-OH group of donors, NAD or NADP as acceptor///protein complex binding	fatty acid beta-oxidation///fatty acid beta-oxidation///fatty acid metabolic process///lipid metabolic process///metabolic process///oxidation-reduction process///response to drug///response to insulin	mitochondrial fatty acid beta-oxidation multienzyme complex///mitochondrial inner membrane///mitochondrial nucleoid///mitochondrion///mitochondrion///mitochondrion	GO:0003857///GO:0051287///GO:0003988///GO:0003824///GO:0050662///GO:0004300///GO:0004300///GO:0000062///GO:0016509///GO:0016509///GO:0016508///GO:0016829///GO:0016491///GO:0016616///GO:0032403	GO:0006635///GO:0006635///GO:0006631///GO:0006629///GO:0008152///GO:0055114///GO:0042493///GO:0032868	GO:0016507///GO:0005743///GO:0042645///GO:0005739///GO:0005739///GO:0005739
1428000_at	0.757727666945685	0.225249306549349	-1.3246180610542	-5.21177647823266	-0.245311473408046	Tmem60	transmembrane protein 60	212090	5	molecular_function	biological_process	cellular_component///integral component of membrane///membrane	GO:0003674	GO:0008150	GO:0005575///GO:0016021///GO:0016020
1418467_at	0.772608413086327	0.245803529183947	1.26188137704414	-5.2818788794059	0.210216723886342	Smarcd3	SWI/SNF related, matrix associated, actin dependent regulator of chromatin, subfamily d, member 3	66993	5	ligand-dependent nuclear receptor binding///ligand-dependent nuclear receptor transcription coactivator activity///nuclear hormone receptor binding///protein binding///receptor binding///transcription factor binding	cardiac right ventricle formation///chromatin modification///chromatin remodeling///heart morphogenesis///muscle cell differentiation///nervous system development///nucleosome disassembly///positive regulation of neuroblast proliferation///positive regulation of transcription, DNA-templated///positive regulation of transcription, DNA-templated///regulation of protein binding///regulation of transcription from RNA polymerase II promoter///regulation of transcription, DNA-templated///secondary heart field specification///transcription, DNA-templated	SWI/SNF complex///cytoplasm///nBAF complex///npBAF complex///npBAF complex///nuclear chromatin///nucleus///nucleus	GO:0016922///GO:0030374///GO:0035257///GO:0005515///GO:0005102///GO:0008134	GO:0003219///GO:0016568///GO:0006338///GO:0003007///GO:0042692///GO:0007399///GO:0006337///GO:0002052///GO:0045893///GO:0045893///GO:0043393///GO:0006357///GO:0006355///GO:0003139///GO:0006351	GO:0016514///GO:0005737///GO:0071565///GO:0071564///GO:0071564///GO:0000790///GO:0005634///GO:0005634
1428216_s_at	0.786954915744918	0.273661290987805	1.18361756776844	-5.36633653972844	0.0989810514646177	Tomm7	translocase of outer mitochondrial membrane 7 homolog (yeast)	66169	5	molecular_function	biological_process///protein import into mitochondrial matrix///protein transport///transport	integral component of membrane///membrane///mitochondrial outer membrane///mitochondrial outer membrane translocase complex///mitochondrion///mitochondrion	GO:0003674	GO:0008150///GO:0030150///GO:0015031///GO:0006810	GO:0016021///GO:0016020///GO:0005741///GO:0005742///GO:0005739///GO:0005739
1434363_x_at	0.787196548763316	0.274116713613375	-1.18239462243117	-5.3676284972256	-0.100444412057287	Paxip1	PAX interacting (with transcription-activation domain) protein 1	55982	5 13.23 cM	protein binding	DNA recombination///DNA repair///adipose tissue development///cellular response to DNA damage stimulus///chorion development///endothelial cell migration///positive regulation of histone H3-K36 methylation///positive regulation of histone H3-K4 methylation///positive regulation of histone acetylation///positive regulation of isotype switching///positive regulation of protein ubiquitination///positive regulation of transcription initiation from RNA polymerase II promoter///regulation of transcription, DNA-templated///transcription, DNA-templated///vasculogenesis	histone methyltransferase complex///nucleus	GO:0005515	GO:0006310///GO:0006281///GO:0060612///GO:0006974///GO:0060717///GO:0043542///GO:0000416///GO:0051571///GO:0035066///GO:0045830///GO:0031398///GO:0060261///GO:0006355///GO:0006351///GO:0001570	GO:0035097///GO:0005634
1417135_at	0.790331846169714	0.277380593614438	-1.17367909991131	-5.37681032608845	-0.498786195785218	Srpk2	serine/arginine-rich protein specific kinase 2	20817	5 10.36 cM	14-3-3 protein binding///ATP binding///ATP binding///kinase activity///magnesium ion binding///magnesium ion binding///nucleotide binding///poly(A) RNA binding///protein binding///protein kinase activity///protein serine/threonine kinase activity///protein serine/threonine kinase activity///transferase activity///transferase activity, transferring phosphorus-containing groups	RNA splicing///RNA splicing///angiogenesis///cell differentiation///intracellular signal transduction///intracellular signal transduction///mRNA processing///negative regulation of viral genome replication///nuclear speck organization///phosphorylation///positive regulation of cell cycle///positive regulation of cell proliferation///positive regulation of cell proliferation///positive regulation of gene expression///positive regulation of neuron apoptotic process///positive regulation of viral genome replication///protein phosphorylation///protein phosphorylation///spliceosomal complex assembly///spliceosomal complex assembly	cytoplasm///cytoplasm///nucleus///nucleus	GO:0071889///GO:0005524///GO:0005524///GO:0016301///GO:0000287///GO:0000287///GO:0000166///GO:0044822///GO:0005515///GO:0004672///GO:0004674///GO:0004674///GO:0016740///GO:0016772	GO:0008380///GO:0008380///GO:0001525///GO:0030154///GO:0035556///GO:0035556///GO:0006397///GO:0045071///GO:0035063///GO:0016310///GO:0045787///GO:0008284///GO:0008284///GO:0010628///GO:0043525///GO:0045070///GO:0006468///GO:0006468///GO:0000245///GO:0000245	GO:0005737///GO:0005737///GO:0005634///GO:0005634
1426881_at	0.807308498873766	0.30982998713939	-1.09131452569074	-5.46130111721848	-0.178143488234026	Ube3c	ubiquitin protein ligase E3C	100763	5	UDP-N-acetylmuramoylalanyl-D-glutamyl-2,6-diaminopimelate-D-alanyl-D-alanine ligase activity///coenzyme F420-0 gamma-glutamyl ligase activity///coenzyme F420-2 alpha-glutamyl ligase activity///ligase activity///protein-glutamic acid ligase activity///protein-glycine ligase activity///protein-glycine ligase activity, elongating///protein-glycine ligase activity, initiating///ribosomal S6-glutamic acid ligase activity///tubulin-glutamic acid ligase activity///tubulin-glycine ligase activity///ubiquitin-protein transferase activity///ubiquitin-protein transferase activity	protein polyubiquitination///protein ubiquitination involved in ubiquitin-dependent protein catabolic process	cytoplasm///nucleus	GO:0008766///GO:0043773///GO:0043774///GO:0016874///GO:0070739///GO:0070735///GO:0070737///GO:0070736///GO:0018169///GO:0070740///GO:0070738///GO:0004842///GO:0004842	GO:0000209///GO:0042787	GO:0005737///GO:0005634
1420532_at	0.808004815136431	0.312019308266259	-1.08601368506284	-5.46659297700351	-0.0712920230924858	Magi2	membrane associated guanylate kinase, WW and PDZ domain containing 2	50791	5	PDZ domain binding///SMAD binding///beta-1 adrenergic receptor binding///phosphatase binding///protein binding///protein complex binding///receptor signaling complex scaffold activity///receptor signaling complex scaffold activity///signal transducer activity///type II activin receptor binding	SMAD protein signal transduction///cellular response to nerve growth factor stimulus///cytoplasmic transport///mitotic cell cycle arrest///negative regulation of activin receptor signaling pathway///negative regulation of cell migration///negative regulation of cell proliferation///negative regulation of protein kinase B signaling///nerve growth factor signaling pathway///nervous system development///positive regulation of neuron projection development///positive regulation of phosphoprotein phosphatase activity///positive regulation of receptor internalization///protein heterooligomerization///receptor clustering///signal transduction	cell junction///cytoplasm///cytoplasm///dendrite///endosome///late endosome///membrane///neuron projection///nucleus///perinuclear region of cytoplasm///plasma membrane///plasma membrane///postsynaptic density///protein complex///slit diaphragm///synapse///tight junction	GO:0030165///GO:0046332///GO:0031697///GO:0019902///GO:0005515///GO:0032403///GO:0030159///GO:0030159///GO:0004871///GO:0070699	GO:0060395///GO:1990090///GO:0016482///GO:0071850///GO:0032926///GO:0030336///GO:0008285///GO:0051898///GO:0038180///GO:0007399///GO:0010976///GO:0032516///GO:0002092///GO:0051291///GO:0043113///GO:0007165	GO:0030054///GO:0005737///GO:0005737///GO:0030425///GO:0005768///GO:0005770///GO:0016020///GO:0043005///GO:0005634///GO:0048471///GO:0005886///GO:0005886///GO:0014069///GO:0043234///GO:0036057///GO:0045202///GO:0005923
1438690_at	0.808208204833844	0.312564897356073	-1.08469733116354	-5.46790428857436	-0.0994064303322189	Tyms	thymidylate synthase	22171	5 15.81 cM	cofactor binding///drug binding///folic acid binding///mRNA binding///methyltransferase activity///nucleotide binding///protein homodimerization activity///thymidylate synthase activity///transferase activity	dTMP biosynthetic process///dUMP metabolic process///methylation///nucleotide biosynthetic process	cytoplasm///membrane///mitochondrial inner membrane///mitochondrial matrix///mitochondrion///nucleolus///nucleus	GO:0048037///GO:0008144///GO:0005542///GO:0003729///GO:0008168///GO:0000166///GO:0042803///GO:0004799///GO:0016740	GO:0006231///GO:0046078///GO:0032259///GO:0009165	GO:0005737///GO:0016020///GO:0005743///GO:0005759///GO:0005739///GO:0005730///GO:0005634
1460635_at	0.809269891070146	0.314262029430554	-1.08061434583145	-5.4719644928045	-0.242287599980568	Fastk	Fas-activated serine/threonine kinase	66587	5	ATP binding///Fas-activated serine/threonine kinase activity///kinase activity///nucleotide binding///protein kinase activity///protein serine/threonine kinase activity///transferase activity	apoptotic process///phosphorylation///protein phosphorylation///regulation of RNA splicing	mitochondrion///nuclear speck	GO:0005524///GO:0033867///GO:0016301///GO:0000166///GO:0004672///GO:0004674///GO:0016740	GO:0006915///GO:0016310///GO:0006468///GO:0043484	GO:0005739///GO:0016607
1422590_at	0.813686403044423	0.319325884038967	-1.06853536957626	-5.48391249043412	-0.0612679150980942	Cdk5	cyclin-dependent kinase 5	12568	5 11.73 cM	ATP binding///ErbB-2 class receptor binding///ErbB-3 class receptor binding///acetylcholine receptor activator activity///cyclin-dependent protein serine/threonine kinase activity///cytoskeletal protein binding///ephrin receptor binding///kinase activity///nucleotide binding///p53 binding///protein binding///protein kinase activity///protein kinase activity///protein kinase activity///protein kinase binding///protein serine/threonine kinase activity///protein serine/threonine kinase activity///tau-protein kinase activity///transferase activity///transferase activity, transferring phosphorus-containing groups	Schwann cell development///apoptotic process///associative learning///axonogenesis///behavioral response to cocaine///calcium ion import///cell cycle///cell death///cell division///cell migration///cell migration///cell-matrix adhesion///central nervous system neuron development///cerebellar cortex development///cerebellar cortex formation///cerebellum development///cerebral cortex development///corpus callosum development///cortical actin cytoskeleton organization///dendrite morphogenesis///exocytosis///forebrain development///hippocampus development///intracellular protein transport///layer formation in cerebral cortex///motor neuron axon guidance///negative regulation of axon extension///negative regulation of cell cycle///negative regulation of neuron death///negative regulation of protein export from nucleus///negative regulation of protein ubiquitination///negative regulation of proteolysis///negative regulation of synaptic plasticity///negative regulation of transcription, DNA-templated///nervous system development///neuron apoptotic process///neuron apoptotic process///neuron differentiation///neuron differentiation///neuron differentiation///neuron migration///neuron projection development///neuron projection morphogenesis///nucleocytoplasmic transport///oligodendrocyte differentiation///peptidyl-serine phosphorylation///peptidyl-serine phosphorylation///peptidyl-serine phosphorylation///peptidyl-threonine phosphorylation///phosphorylation///positive regulation of calcium ion-dependent exocytosis///positive regulation of neuron apoptotic process///positive regulation of protein binding///positive regulation of protein kinase activity///positive regulation of protein targeting to membrane///positive regulation of receptor activity///protein autophosphorylation///protein localization to synapse///protein phosphorylation///protein phosphorylation///protein phosphorylation///protein phosphorylation///receptor catabolic process///receptor clustering///regulated secretory pathway///regulation of cell cycle///regulation of cell migration///regulation of dendritic spine morphogenesis///regulation of excitatory postsynaptic membrane potential///regulation of postsynaptic membrane potential///regulation of synaptic plasticity///response to cocaine///response to wounding///rhythmic process///sensory perception of pain///serine phosphorylation of STAT3 protein///skeletal muscle tissue development///synapse assembly///synaptic transmission, dopaminergic///synaptic transmission, glutamatergic///synaptic vesicle endocytosis///telencephalon development///visual learning	axon///axon///cell///cell junction///cell projection///cyclin-dependent protein kinase 5 holoenzyme complex///cytoplasm///cytoplasm///cytoskeleton///cytosol///dendrite///filopodium///growth cone///intracellular///lamellipodium///membrane///neuromuscular junction///neuronal cell body///NOT nucleolus///nucleus///nucleus///plasma membrane///postsynaptic density///postsynaptic membrane///synapse	GO:0005524///GO:0005176///GO:0043125///GO:0030549///GO:0004693///GO:0008092///GO:0046875///GO:0016301///GO:0000166///GO:0002039///GO:0005515///GO:0004672///GO:0004672///GO:0004672///GO:0019901///GO:0004674///GO:0004674///GO:0050321///GO:0016740///GO:0016772	GO:0014044///GO:0006915///GO:0008306///GO:0007409///GO:0048148///GO:0070509///GO:0007049///GO:0008219///GO:0051301///GO:0016477///GO:0016477///GO:0007160///GO:0021954///GO:0021695///GO:0021697///GO:0021549///GO:0021987///GO:0022038///GO:0030866///GO:0048813///GO:0006887///GO:0030900///GO:0021766///GO:0006886///GO:0021819///GO:0008045///GO:0030517///GO:0045786///GO:1901215///GO:0046826///GO:0031397///GO:0045861///GO:0031914///GO:0045892///GO:0007399///GO:0051402///GO:0051402///GO:0030182///GO:0030182///GO:0030182///GO:0001764///GO:0031175///GO:0048812///GO:0006913///GO:0048709///GO:0018105///GO:0018105///GO:0018105///GO:0018107///GO:0016310///GO:0045956///GO:0043525///GO:0032092///GO:0045860///GO:0090314///GO:2000273///GO:0046777///GO:0035418///GO:0006468///GO:0006468///GO:0006468///GO:0006468///GO:0032801///GO:0043113///GO:0045055///GO:0051726///GO:0030334///GO:0061001///GO:0060079///GO:0060078///GO:0048167///GO:0042220///GO:0009611///GO:0048511///GO:0019233///GO:0033136///GO:0007519///GO:0007416///GO:0001963///GO:0035249///GO:0048488///GO:0021537///GO:0008542	GO:0030424///GO:0030424///GO:0005623///GO:0030054///GO:0042995///GO:0016533///GO:0005737///GO:0005737///GO:0005856///GO:0005829///GO:0030425///GO:0030175///GO:0030426///GO:0005622///GO:0030027///GO:0016020///GO:0031594///GO:0043025///NOT GO:0005730///GO:0005634///GO:0005634///GO:0005886///GO:0014069///GO:0045211///GO:0045202
1417641_at	0.819056329007378	0.327088373565637	1.05031140161587	-5.50175705228767	0.0699994326743267	Galntl5	UDP-N-acetyl-alpha-D-galactosamine:polypeptide N-acetylgalactosaminyltransferase-like 5	67909	5	metal ion binding///molecular_function///transferase activity///transferase activity, transferring glycosyl groups	cell differentiation///spermatid development///spermatid development///spermatogenesis	endosome///integral component of membrane///membrane	GO:0046872///GO:0003674///GO:0016740///GO:0016757	GO:0030154///GO:0007286///GO:0007286///GO:0007283	GO:0005768///GO:0016021///GO:0016020
1450674_at	0.822283095491429	0.331160111353049	-1.04088847746568	-5.51089699016127	-0.131353468702299	Cdk5	cyclin-dependent kinase 5	12568	5 11.73 cM	ATP binding///ErbB-2 class receptor binding///ErbB-3 class receptor binding///acetylcholine receptor activator activity///cyclin-dependent protein serine/threonine kinase activity///cytoskeletal protein binding///ephrin receptor binding///kinase activity///nucleotide binding///p53 binding///protein binding///protein kinase activity///protein kinase activity///protein kinase activity///protein kinase binding///protein serine/threonine kinase activity///protein serine/threonine kinase activity///tau-protein kinase activity///transferase activity///transferase activity, transferring phosphorus-containing groups	Schwann cell development///apoptotic process///associative learning///axonogenesis///behavioral response to cocaine///calcium ion import///cell cycle///cell death///cell division///cell migration///cell migration///cell-matrix adhesion///central nervous system neuron development///cerebellar cortex development///cerebellar cortex formation///cerebellum development///cerebral cortex development///corpus callosum development///cortical actin cytoskeleton organization///dendrite morphogenesis///exocytosis///forebrain development///hippocampus development///intracellular protein transport///layer formation in cerebral cortex///motor neuron axon guidance///negative regulation of axon extension///negative regulation of cell cycle///negative regulation of neuron death///negative regulation of protein export from nucleus///negative regulation of protein ubiquitination///negative regulation of proteolysis///negative regulation of synaptic plasticity///negative regulation of transcription, DNA-templated///nervous system development///neuron apoptotic process///neuron apoptotic process///neuron differentiation///neuron differentiation///neuron differentiation///neuron migration///neuron projection development///neuron projection morphogenesis///nucleocytoplasmic transport///oligodendrocyte differentiation///peptidyl-serine phosphorylation///peptidyl-serine phosphorylation///peptidyl-serine phosphorylation///peptidyl-threonine phosphorylation///phosphorylation///positive regulation of calcium ion-dependent exocytosis///positive regulation of neuron apoptotic process///positive regulation of protein binding///positive regulation of protein kinase activity///positive regulation of protein targeting to membrane///positive regulation of receptor activity///protein autophosphorylation///protein localization to synapse///protein phosphorylation///protein phosphorylation///protein phosphorylation///protein phosphorylation///receptor catabolic process///receptor clustering///regulated secretory pathway///regulation of cell cycle///regulation of cell migration///regulation of dendritic spine morphogenesis///regulation of excitatory postsynaptic membrane potential///regulation of postsynaptic membrane potential///regulation of synaptic plasticity///response to cocaine///response to wounding///rhythmic process///sensory perception of pain///serine phosphorylation of STAT3 protein///skeletal muscle tissue development///synapse assembly///synaptic transmission, dopaminergic///synaptic transmission, glutamatergic///synaptic vesicle endocytosis///telencephalon development///visual learning	axon///axon///cell///cell junction///cell projection///cyclin-dependent protein kinase 5 holoenzyme complex///cytoplasm///cytoplasm///cytoskeleton///cytosol///dendrite///filopodium///growth cone///intracellular///lamellipodium///membrane///neuromuscular junction///neuronal cell body///NOT nucleolus///nucleus///nucleus///plasma membrane///postsynaptic density///postsynaptic membrane///synapse	GO:0005524///GO:0005176///GO:0043125///GO:0030549///GO:0004693///GO:0008092///GO:0046875///GO:0016301///GO:0000166///GO:0002039///GO:0005515///GO:0004672///GO:0004672///GO:0004672///GO:0019901///GO:0004674///GO:0004674///GO:0050321///GO:0016740///GO:0016772	GO:0014044///GO:0006915///GO:0008306///GO:0007409///GO:0048148///GO:0070509///GO:0007049///GO:0008219///GO:0051301///GO:0016477///GO:0016477///GO:0007160///GO:0021954///GO:0021695///GO:0021697///GO:0021549///GO:0021987///GO:0022038///GO:0030866///GO:0048813///GO:0006887///GO:0030900///GO:0021766///GO:0006886///GO:0021819///GO:0008045///GO:0030517///GO:0045786///GO:1901215///GO:0046826///GO:0031397///GO:0045861///GO:0031914///GO:0045892///GO:0007399///GO:0051402///GO:0051402///GO:0030182///GO:0030182///GO:0030182///GO:0001764///GO:0031175///GO:0048812///GO:0006913///GO:0048709///GO:0018105///GO:0018105///GO:0018105///GO:0018107///GO:0016310///GO:0045956///GO:0043525///GO:0032092///GO:0045860///GO:0090314///GO:2000273///GO:0046777///GO:0035418///GO:0006468///GO:0006468///GO:0006468///GO:0006468///GO:0032801///GO:0043113///GO:0045055///GO:0051726///GO:0030334///GO:0061001///GO:0060079///GO:0060078///GO:0048167///GO:0042220///GO:0009611///GO:0048511///GO:0019233///GO:0033136///GO:0007519///GO:0007416///GO:0001963///GO:0035249///GO:0048488///GO:0021537///GO:0008542	GO:0030424///GO:0030424///GO:0005623///GO:0030054///GO:0042995///GO:0016533///GO:0005737///GO:0005737///GO:0005856///GO:0005829///GO:0030425///GO:0030175///GO:0030426///GO:0005622///GO:0030027///GO:0016020///GO:0031594///GO:0043025///NOT GO:0005730///GO:0005634///GO:0005634///GO:0005886///GO:0014069///GO:0045211///GO:0045202
1427150_at	0.842293789711849	0.376957466236627	-0.94064229266045	-5.60432713940119	-0.161548427950757	Kmt2c	lysine (K)-specific methyltransferase 2C	231051	5	DNA binding///histone methyltransferase activity (H3-K4 specific)///histone-lysine N-methyltransferase activity///metal ion binding///methyltransferase activity///poly(A) RNA binding///transferase activity///zinc ion binding	chromatin modification///histone H3-K4 methylation///histone methylation///intracellular signal transduction///methylation///peptidyl-lysine methylation///regulation of transcription, DNA-templated///transcription, DNA-templated	histone methyltransferase complex///nucleus	GO:0003677///GO:0042800///GO:0018024///GO:0046872///GO:0008168///GO:0044822///GO:0016740///GO:0008270	GO:0016568///GO:0051568///GO:0016571///GO:0035556///GO:0032259///GO:0018022///GO:0006355///GO:0006351	GO:0035097///GO:0005634
