ID (num probes:45101)	adj.P.Val	P.Value	t	B	logFC	Gene.symbol	Gene.title	Gene.ID	Chromosome.location	GO.Function	GO.Process	GO.Component	GO.Function.ID	GO.Process.ID	GO.Component.ID
1418119_at	0.999989313241072	0.96009419407596	0.0516064070247836	-4.77641232589592	0.0233582118105709	Rbm8a	RNA binding motif protein 8a	60365	3 H3	mRNA binding///poly(A) RNA binding	nuclear-transcribed mRNA catabolic process, nonsense-mediated decay///regulation of alternative mRNA splicing, via spliceosome	catalytic step 2 spliceosome///exon-exon junction complex///nucleus///nucleus	GO:0003729///GO:0044822	GO:0000184///GO:0000381	GO:0071013///GO:0035145///GO:0005634///GO:0005634
1444410_at	0.999989313241072	0.96771023209772	-0.0417501134341324	-4.77656980163871	-0.029497958558963	Acp6	acid phosphatase 6, lysophosphatidic	66659	3	acid phosphatase activity///hydrolase activity///lysophosphatidic acid phosphatase activity	dephosphorylation///hematopoietic progenitor cell differentiation///lipid metabolic process///lysobisphosphatidic acid metabolic process///phospholipid metabolic process	cytoplasm///mitochondrion///mitochondrion	GO:0003993///GO:0016787///GO:0052642	GO:0016311///GO:0002244///GO:0006629///GO:2001311///GO:0006644	GO:0005737///GO:0005739///GO:0005739
1436784_x_at	0.999989313241072	0.973156855438146	0.034704223246666	-4.77666200776123	0.0228747743378568	Sf3b4	splicing factor 3b, subunit 4	107701	3	RNA binding///nucleic acid binding///nucleotide binding///poly(A) RNA binding	RNA splicing///mRNA processing	U12-type spliceosomal complex///nucleus///spliceosomal complex	GO:0003723///GO:0003676///GO:0000166///GO:0044822	GO:0008380///GO:0006397	GO:0005689///GO:0005634///GO:0005681
1460426_at	0.999989313241072	0.984969540292714	-0.019429157146347	-4.77680356502489	-0.00717391211729268	Pde4dip	phosphodiesterase 4D interacting protein (myomegalin)	83679	3 42.28 cM	enzyme binding///enzyme binding///protein binding	cellular protein complex assembly///cellular protein complex assembly	Golgi apparatus///Golgi apparatus///centrosome///centrosome///cytoplasm///cytoskeleton///myofibril///myofibril///nucleus	GO:0019899///GO:0019899///GO:0005515	GO:0043623///GO:0043623	GO:0005794///GO:0005794///GO:0005813///GO:0005813///GO:0005737///GO:0005856///GO:0030016///GO:0030016///GO:0005634
1451213_at	0.999989313241072	0.985439360632194	0.0188217609528123	-4.77680754276618	0.0065473945884893	Pex11b	peroxisomal biogenesis factor 11 beta	18632	3	protein homodimerization activity	cell adhesion///integrin-mediated signaling pathway///peroxisome fission///peroxisome organization///protein homooligomerization///regulation of peroxisome size	extracellular vesicular exosome///integral component of membrane///integral component of peroxisomal membrane///membrane///mitochondrion///peroxisomal membrane///peroxisome///protein complex	GO:0042803	GO:0007155///GO:0007229///GO:0016559///GO:0007031///GO:0051260///GO:0044375	GO:0070062///GO:0016021///GO:0005779///GO:0016020///GO:0005739///GO:0005778///GO:0005777///GO:0043234
1440235_at	0.999989313241072	0.990502467609421	0.0122764849898193	-4.77684239228467	0.00588029278882019	Itga10	integrin, alpha 10	213119	3 F2.2	collagen binding involved in cell-matrix adhesion	cell adhesion///cell-matrix adhesion///integrin-mediated signaling pathway	integral component of membrane///integrin alpha10-beta1 complex///membrane	GO:0098639	GO:0007155///GO:0007160///GO:0007229	GO:0016021///GO:0034680///GO:0016020
