ID (num probes:45101)	adj.P.Val	P.Value	t	B	logFC	Gene.symbol	Gene.title	Gene.ID	Chromosome.location	GO.Function	GO.Process	GO.Component	GO.Function.ID	GO.Process.ID	GO.Component.ID
1460232_s_at	0.999989313241072	0.335207863813866	-1.02462448703382	-4.61491230991746	-0.439938330327372	Hsd3b6///Hsd3b3///Hsd3b2	hydroxy-delta-5-steroid dehydrogenase, 3 beta- and steroid delta-isomerase 6///hydroxy-delta-5-steroid dehydrogenase, 3 beta- and steroid delta-isomerase 3///hydroxy-delta-5-steroid dehydrogenase, 3 beta- and steroid delta-isomerase 2	15497///15494///15493	3///3 42.86 cM///3 42.85 cM	(R)-(-)-1,2,3,4-tetrahydronaphthol dehydrogenase activity///(R)-2-hydroxyglutarate dehydrogenase activity///(R)-2-hydroxyisocaproate dehydrogenase activity///2-hydroxytetrahydrofuran dehydrogenase activity///3-beta-hydroxy-delta5-steroid dehydrogenase activity///3-hydroxymenthone dehydrogenase activity///3-ketoglucose-reductase activity///5-exo-hydroxycamphor dehydrogenase activity///C-3 sterol dehydrogenase (C-4 sterol decarboxylase) activity///D-arabinitol dehydrogenase, D-ribulose forming (NADP+) activity///D-arabinitol dehydrogenase, D-xylulose forming (NADP+) activity///D-xylose:NADP reductase activity///L-arabinose 1-dehydrogenase (NADP+) activity///L-arabinose:NADP reductase activity///L-xylulose reductase (NAD+) activity///acetoin dehydrogenase activity///aldo-keto reductase (NADP) activity///catalytic activity///dihydrotestosterone 17-beta-dehydrogenase activity///epoxide dehydrogenase activity///gluconate dehydrogenase activity///isocitrate dehydrogenase activity///isomerase activity///mevaldate reductase activity///oxidoreductase activity///oxidoreductase activity, acting on the CH-OH group of donors, NAD or NADP as acceptor///phenylcoumaran benzylic ether reductase activity///steroid dehydrogenase activity///steroid dehydrogenase activity, acting on the CH-CH group of donors///steroid dehydrogenase activity, acting on the CH-OH group of donors, NAD or NADP as acceptor///steroid delta-isomerase activity///very long-chain-3-hydroxyacyl-CoA dehydrogenase activity///3-beta-hydroxy-delta5-steroid dehydrogenase activity///catalytic activity///isomerase activity///oxidoreductase activity///oxidoreductase activity, acting on the CH-OH group of donors, NAD or NADP as acceptor///steroid delta-isomerase activity///3-beta-hydroxy-delta5-steroid dehydrogenase activity///catalytic activity///isomerase activity///oxidoreductase activity///oxidoreductase activity, acting on the CH-OH group of donors, NAD or NADP as acceptor///steroid delta-isomerase activity	metabolic process///oxidation-reduction process///steroid biosynthetic process///metabolic process///oxidation-reduction process///steroid biosynthetic process///metabolic process///oxidation-reduction process///steroid biosynthetic process	endoplasmic reticulum///integral component of membrane///membrane///mitochondrial inner membrane///mitochondrial intermembrane space///mitochondrion///endoplasmic reticulum///integral component of membrane///membrane///mitochondrial inner membrane///mitochondrial inner membrane///mitochondrial intermembrane space///mitochondrion///endoplasmic reticulum///integral component of membrane///membrane///mitochondrial inner membrane///mitochondrial intermembrane space///mitochondrion	GO:0034831///GO:0051990///GO:0043713///GO:0018453///GO:0003854///GO:0034840///GO:0048258///GO:0018452///GO:0000252///GO:0033709///GO:0052677///GO:0032866///GO:0044103///GO:0032867///GO:0044105///GO:0019152///GO:0004033///GO:0003824///GO:0035410///GO:0018451///GO:0008875///GO:0004448///GO:0016853///GO:0004495///GO:0016491///GO:0016616///GO:0032442///GO:0016229///GO:0033765///GO:0033764///GO:0004769///GO:0035380///GO:0003854///GO:0003824///GO:0016853///GO:0016491///GO:0016616///GO:0004769///GO:0003854///GO:0003824///GO:0016853///GO:0016491///GO:0016616///GO:0004769	GO:0008152///GO:0055114///GO:0006694///GO:0008152///GO:0055114///GO:0006694///GO:0008152///GO:0055114///GO:0006694	GO:0005783///GO:0016021///GO:0016020///GO:0005743///GO:0005758///GO:0005739///GO:0005783///GO:0016021///GO:0016020///GO:0005743///GO:0005743///GO:0005758///GO:0005739///GO:0005783///GO:0016021///GO:0016020///GO:0005743///GO:0005758///GO:0005739
1429223_a_at	0.999989313241072	0.357807278137997	0.975021035076479	-4.62882991109595	0.579138346803764	Hfe2	hemochromatosis type 2 (juvenile) (human homolog)	69585	3	coreceptor activity///protein binding	BMP signaling pathway///BMP signaling pathway///iron ion homeostasis///iron ion homeostasis///positive regulation of transcription from RNA polymerase II promoter///positive regulation of transcription from RNA polymerase II promoter	anchored component of membrane///basolateral plasma membrane///cell surface///extracellular space///membrane///plasma membrane	GO:0015026///GO:0005515	GO:0030509///GO:0030509///GO:0055072///GO:0055072///GO:0045944///GO:0045944	GO:0031225///GO:0016323///GO:0009986///GO:0005615///GO:0016020///GO:0005886
1451115_at	0.999989313241072	0.370760450401352	-0.94764699765835	-4.63632188199123	-0.257420028409504	Pias3	protein inhibitor of activated STAT 3	229615	3	SUMO ligase activity///UDP-N-acetylmuramoylalanyl-D-glutamyl-2,6-diaminopimelate-D-alanyl-D-alanine ligase activity///coenzyme F420-0 gamma-glutamyl ligase activity///coenzyme F420-2 alpha-glutamyl ligase activity///enzyme binding///ligase activity///metal ion binding///potassium channel regulator activity///protein C-terminus binding///protein N-terminus binding///protein binding///protein-glutamic acid ligase activity///protein-glycine ligase activity///protein-glycine ligase activity, elongating///protein-glycine ligase activity, initiating///ribosomal S6-glutamic acid ligase activity///tubulin-glutamic acid ligase activity///tubulin-glycine ligase activity///zinc ion binding	positive regulation of gene expression///positive regulation of membrane potential///positive regulation of protein sumoylation///protein sumoylation///regulation of transcription, DNA-templated///transcription, DNA-templated	cytoplasm///dendrite///nucleus///nucleus///synapse	GO:0019789///GO:0008766///GO:0043773///GO:0043774///GO:0019899///GO:0016874///GO:0046872///GO:0015459///GO:0008022///GO:0047485///GO:0005515///GO:0070739///GO:0070735///GO:0070737///GO:0070736///GO:0018169///GO:0070740///GO:0070738///GO:0008270	GO:0010628///GO:0045838///GO:0033235///GO:0016925///GO:0006355///GO:0006351	GO:0005737///GO:0030425///GO:0005634///GO:0005634///GO:0045202
1424057_at	0.999989313241072	0.378455748691382	-0.931719180916564	-4.64061668121022	-0.184949678335473	Gdap2	ganglioside-induced differentiation-associated-protein 2	14547	3	molecular_function	response to retinoic acid	lysosomal membrane	GO:0003674	GO:0032526	GO:0005765
1448445_at	0.999989313241072	0.389601224126368	0.909066461452108	-4.64664063546342	0.223179687328267	Acp6	acid phosphatase 6, lysophosphatidic	66659	3	acid phosphatase activity///hydrolase activity///lysophosphatidic acid phosphatase activity	dephosphorylation///hematopoietic progenitor cell differentiation///lipid metabolic process///lysobisphosphatidic acid metabolic process///phospholipid metabolic process	cytoplasm///mitochondrion///mitochondrion	GO:0003993///GO:0016787///GO:0052642	GO:0016311///GO:0002244///GO:0006629///GO:2001311///GO:0006644	GO:0005737///GO:0005739///GO:0005739
1418120_at	0.999989313241072	0.42719868888881	0.835930929935636	-4.66538138987339	0.359728000665416	Rbm8a	RNA binding motif protein 8a	60365	3 H3	mRNA binding///poly(A) RNA binding	nuclear-transcribed mRNA catabolic process, nonsense-mediated decay///regulation of alternative mRNA splicing, via spliceosome	catalytic step 2 spliceosome///exon-exon junction complex///nucleus///nucleus	GO:0003729///GO:0044822	GO:0000184///GO:0000381	GO:0071013///GO:0035145///GO:0005634///GO:0005634
1429682_at	0.999989313241072	0.427708356914566	-0.834971327890131	-4.66561980913069	-0.594624773971724	Fam46c	family with sequence similarity 46, member C	74645	3	molecular_function	biological_process	cellular_component	GO:0003674	GO:0008150	GO:0005575
1430677_at	0.999989313241072	0.447549736263199	-0.798211881420764	-4.67460070635804	-0.256175676170837	4930442L01Rik	RIKEN cDNA 4930442L01 gene	67583	3						
1431833_a_at	0.999989313241072	0.494032314140701	-0.716189000898992	-4.6935225607882	-0.267998743354084	Hmgcs2	3-hydroxy-3-methylglutaryl-Coenzyme A synthase 2	15360	3 42.74 cM	catalytic activity///hydroxymethylglutaryl-CoA synthase activity///transferase activity	cholesterol biosynthetic process///cholesterol metabolic process///isoprenoid biosynthetic process///lipid metabolic process///metabolic process///steroid biosynthetic process///steroid metabolic process///sterol biosynthetic process	mitochondrial inner membrane///mitochondrial matrix///mitochondrion	GO:0003824///GO:0004421///GO:0016740	GO:0006695///GO:0008203///GO:0008299///GO:0006629///GO:0008152///GO:0006694///GO:0008202///GO:0016126	GO:0005743///GO:0005759///GO:0005739
1425127_at	0.999989313241072	0.499005632680368	0.707715694892648	-4.69538535924838	0.628133385559534	Hsd3b2	hydroxy-delta-5-steroid dehydrogenase, 3 beta- and steroid delta-isomerase 2	15493	3 42.85 cM	3-beta-hydroxy-delta5-steroid dehydrogenase activity///catalytic activity///isomerase activity///oxidoreductase activity///oxidoreductase activity, acting on the CH-OH group of donors, NAD or NADP as acceptor///steroid delta-isomerase activity	metabolic process///oxidation-reduction process///steroid biosynthetic process	endoplasmic reticulum///integral component of membrane///membrane///mitochondrial inner membrane///mitochondrial intermembrane space///mitochondrion	GO:0003854///GO:0003824///GO:0016853///GO:0016491///GO:0016616///GO:0004769	GO:0008152///GO:0055114///GO:0006694	GO:0005783///GO:0016021///GO:0016020///GO:0005743///GO:0005758///GO:0005739
1460130_at	0.999989313241072	0.510735922512962	0.687939612266038	-4.69966359395707	0.393464677991101	Gm5544	predicted gene 5544	433632	3						
1418366_at	0.999989313241072	0.536635654413227	-0.645251467768377	-4.70855992376407	-0.2177505365711	Hist2h2aa2///Hist2h2ac///Hist2h2aa1///Hist2h3c1	histone cluster 2, H2aa2///histone cluster 2, H2ac///histone cluster 2, H2aa1///histone cluster 2, H3c1	319192///319176///15267///15077	3///3///3 41.69 cM///3 F1-F2	molecular_function///DNA binding///protein heterodimerization activity///chromatin binding	biological_process///DNA replication-dependent nucleosome assembly///negative regulation of transcription from RNA polymerase II promoter///regulation of gene silencing	extracellular vesicular exosome///nucleus///chromosome///extracellular vesicular exosome///nucleosome///nucleus///extracellular vesicular exosome///nucleus///extracellular vesicular exosome///membrane///nuclear chromosome///nucleus///nucleus///protein complex	GO:0003674///GO:0003677///GO:0046982///GO:0003682	GO:0008150///GO:0006335///GO:0000122///GO:0060968	GO:0070062///GO:0005634///GO:0005694///GO:0070062///GO:0000786///GO:0005634///GO:0070062///GO:0005634///GO:0070062///GO:0016020///GO:0000228///GO:0005634///GO:0005634///GO:0043234
1456847_at	0.999989313241072	0.543076665903087	-0.634830434690354	-4.71065989255543	-0.517682995866858	Cd160	CD160 antigen	54215	3	MHC class I receptor activity///receptor binding	defense response to Gram-negative bacterium///signal transduction	anchored component of membrane///anchored component of plasma membrane///membrane///plasma membrane	GO:0032393///GO:0005102	GO:0050829///GO:0007165	GO:0031225///GO:0046658///GO:0016020///GO:0005886
1436546_at	0.999989313241072	0.547185671958098	-0.628220811130519	-4.71197695912026	-0.13539622418357	Lix1l	Lix1-like	280411	3	molecular_function	autophagic vacuole maturation///autophagy///biological_process	cellular_component///cytoplasm	GO:0003674	GO:0097352///GO:0006914///GO:0008150	GO:0005575///GO:0005737
1438815_at	0.999989313241072	0.582373051902108	0.572764928645875	-4.72256406382156	0.516479980706161	Hist2h2aa2///Hist2h2aa1	histone cluster 2, H2aa2///histone cluster 2, H2aa1	319192///15267	3///3 41.69 cM	molecular_function	biological_process	extracellular vesicular exosome///nucleus///extracellular vesicular exosome///nucleus	GO:0003674	GO:0008150	GO:0070062///GO:0005634///GO:0070062///GO:0005634
1421646_a_at	0.999989313241072	0.58900877065855	-0.56252175097768	-4.72442727075932	-0.182698647405463	Pias3	protein inhibitor of activated STAT 3	229615	3	SUMO ligase activity///UDP-N-acetylmuramoylalanyl-D-glutamyl-2,6-diaminopimelate-D-alanyl-D-alanine ligase activity///coenzyme F420-0 gamma-glutamyl ligase activity///coenzyme F420-2 alpha-glutamyl ligase activity///enzyme binding///ligase activity///metal ion binding///potassium channel regulator activity///protein C-terminus binding///protein N-terminus binding///protein binding///protein-glutamic acid ligase activity///protein-glycine ligase activity///protein-glycine ligase activity, elongating///protein-glycine ligase activity, initiating///ribosomal S6-glutamic acid ligase activity///tubulin-glutamic acid ligase activity///tubulin-glycine ligase activity///zinc ion binding	positive regulation of gene expression///positive regulation of membrane potential///positive regulation of protein sumoylation///protein sumoylation///regulation of transcription, DNA-templated///transcription, DNA-templated	cytoplasm///dendrite///nucleus///nucleus///synapse	GO:0019789///GO:0008766///GO:0043773///GO:0043774///GO:0019899///GO:0016874///GO:0046872///GO:0015459///GO:0008022///GO:0047485///GO:0005515///GO:0070739///GO:0070735///GO:0070737///GO:0070736///GO:0018169///GO:0070740///GO:0070738///GO:0008270	GO:0010628///GO:0045838///GO:0033235///GO:0016925///GO:0006355///GO:0006351	GO:0005737///GO:0030425///GO:0005634///GO:0005634///GO:0045202
1423615_at	0.999989313241072	0.600709584781655	0.544613272540122	-4.72761414640713	0.130282108390151	Rnf115	ring finger protein 115	67845	3	UDP-N-acetylmuramoylalanyl-D-glutamyl-2,6-diaminopimelate-D-alanyl-D-alanine ligase activity///coenzyme F420-0 gamma-glutamyl ligase activity///coenzyme F420-2 alpha-glutamyl ligase activity///ligase activity///metal ion binding///protein binding///protein-glutamic acid ligase activity///protein-glycine ligase activity///protein-glycine ligase activity, elongating///protein-glycine ligase activity, initiating///ribosomal S6-glutamic acid ligase activity///tubulin-glutamic acid ligase activity///tubulin-glycine ligase activity///ubiquitin-protein transferase activity///zinc ion binding	negative regulation of epidermal growth factor receptor signaling pathway///protein autoubiquitination///ubiquitin-dependent protein catabolic process via the multivesicular body sorting pathway	cytoplasm///cytosol	GO:0008766///GO:0043773///GO:0043774///GO:0016874///GO:0046872///GO:0005515///GO:0070739///GO:0070735///GO:0070737///GO:0070736///GO:0018169///GO:0070740///GO:0070738///GO:0004842///GO:0008270	GO:0042059///GO:0051865///GO:0043162	GO:0005737///GO:0005829
1420396_at	0.999989313241072	0.606624780554459	-0.535631769366292	-4.72917829775661	-0.467643959740986	Cd160	CD160 antigen	54215	3	MHC class I receptor activity///receptor binding	defense response to Gram-negative bacterium///signal transduction	anchored component of membrane///anchored component of plasma membrane///membrane///plasma membrane	GO:0032393///GO:0005102	GO:0050829///GO:0007165	GO:0031225///GO:0046658///GO:0016020///GO:0005886
1451658_a_at	0.999989313241072	0.609308232296788	0.531572727855111	-4.72987765325246	0.197652811483097	Polr3c	polymerase (RNA) III (DNA directed) polypeptide C	74414	3 F2	DNA binding///DNA-directed RNA polymerase activity///contributes_to RNA polymerase III activity///nucleotidyltransferase activity///transferase activity	defense response to virus///immune system process///innate immune response///positive regulation of innate immune response///positive regulation of interferon-beta production///transcription, DNA-templated	DNA-directed RNA polymerase III complex///DNA-directed RNA polymerase III complex///nucleus	GO:0003677///GO:0003899///contributes_to GO:0001056///GO:0016779///GO:0016740	GO:0051607///GO:0002376///GO:0045087///GO:0045089///GO:0032728///GO:0006351	GO:0005666///GO:0005666///GO:0005634
1451574_at	0.999989313241072	0.615352187463424	0.522465098847106	-4.73142969667275	0.109771495911522	Bcl9	B cell CLL/lymphoma 9	77578	3	beta-catenin binding	Wnt signaling pathway///canonical Wnt signaling pathway///myotube differentiation involved in skeletal muscle regeneration///positive regulation of transcription from RNA polymerase II promoter///skeletal muscle cell differentiation///somatic stem cell maintenance	Golgi apparatus///Golgi apparatus///cis-Golgi network///cis-Golgi network///cytoplasm///nucleus	GO:0008013	GO:0016055///GO:0060070///GO:0014908///GO:0045944///GO:0035914///GO:0035019	GO:0005794///GO:0005794///GO:0005801///GO:0005801///GO:0005737///GO:0005634
1420066_s_at	0.999989313241072	0.633507472043309	0.495383841204654	-4.73590311102344	0.210402233984419	Cd160	CD160 antigen	54215	3	MHC class I receptor activity///receptor binding	defense response to Gram-negative bacterium///signal transduction	anchored component of membrane///anchored component of plasma membrane///membrane///plasma membrane	GO:0032393///GO:0005102	GO:0050829///GO:0007165	GO:0031225///GO:0046658///GO:0016020///GO:0005886
1455565_at	0.999989313241072	0.633509075301409	0.495381467417937	-4.73590349377769	0.274806804586246	Bcl9	B cell CLL/lymphoma 9	77578	3	beta-catenin binding	Wnt signaling pathway///canonical Wnt signaling pathway///myotube differentiation involved in skeletal muscle regeneration///positive regulation of transcription from RNA polymerase II promoter///skeletal muscle cell differentiation///somatic stem cell maintenance	Golgi apparatus///Golgi apparatus///cis-Golgi network///cis-Golgi network///cytoplasm///nucleus	GO:0008013	GO:0016055///GO:0060070///GO:0014908///GO:0045944///GO:0035914///GO:0035019	GO:0005794///GO:0005794///GO:0005801///GO:0005801///GO:0005737///GO:0005634
1422195_s_at	0.999989313241072	0.643878894081972	0.480090620565195	-4.7383346669588	0.248516511318901	Tbx15	T-box 15	21384	3 43.03 cM	DNA binding///RNA polymerase II transcription corepressor activity///protein heterodimerization activity///protein homodimerization activity///sequence-specific DNA binding transcription factor activity///transcription regulatory region sequence-specific DNA binding	embryonic cranial skeleton morphogenesis///embryonic skeletal system morphogenesis///embryonic skeletal system morphogenesis///negative regulation of transcription from RNA polymerase II promoter///regulation of transcription, DNA-templated///transcription from RNA polymerase II promoter///transcription, DNA-templated	colocalizes_with Tle3-Aes complex///nucleus	GO:0003677///GO:0001106///GO:0046982///GO:0042803///GO:0003700///GO:0000976	GO:0048701///GO:0048704///GO:0048704///GO:0000122///GO:0006355///GO:0006366///GO:0006351	colocalizes_with GO:0070722///GO:0005634
1441835_x_at	0.999989313241072	0.645792783300333	-0.477281954939	-4.73877373502404	-0.157194620337594	Mtmr11	myotubularin related protein 11	194126	3	molecular_function///phosphatase activity	biological_process///dephosphorylation	cellular_component	GO:0003674///GO:0016791	GO:0008150///GO:0016311	GO:0005575
1424619_at	0.999989313241072	0.653358382966685	0.466219195366356	-4.7404803678156	0.0989767104095822	Sf3b4	splicing factor 3b, subunit 4	107701	3	RNA binding///nucleic acid binding///nucleotide binding///poly(A) RNA binding	RNA splicing///mRNA processing	U12-type spliceosomal complex///nucleus///spliceosomal complex	GO:0003723///GO:0003676///GO:0000166///GO:0044822	GO:0008380///GO:0006397	GO:0005689///GO:0005634///GO:0005681
1452637_a_at	0.999989313241072	0.65367537621417	-0.465757043361409	-4.74055087070844	-0.28358200146886	Bola1	bolA-like 1 (E. coli)	69168	3 F2	molecular_function	biological_process	extracellular region///mitochondrion	GO:0003674	GO:0008150	GO:0005576///GO:0005739
1415996_at	0.999989313241072	0.654247583818553	0.464923083702938	-4.7406779329208	0.197211856705366	Txnip	thioredoxin interacting protein	56338	3 41.93 cM	enzyme inhibitor activity///protein binding///ubiquitin protein ligase binding	cell cycle///cellular response to tumor cell///keratinocyte differentiation///negative regulation of catalytic activity///negative regulation of cell division///negative regulation of transcription from RNA polymerase II promoter///platelet-derived growth factor receptor signaling pathway///positive regulation of apoptotic process///protein import into nucleus///regulation of cell proliferation///regulation of transcription, DNA-templated///response to oxidative stress///transcription, DNA-templated	cell///cytoplasm///cytoplasm///intracellular///mitochondrial intermembrane space///nucleus	GO:0004857///GO:0005515///GO:0031625	GO:0007049///GO:0071228///GO:0030216///GO:0043086///GO:0051782///GO:0000122///GO:0048008///GO:0043065///GO:0006606///GO:0042127///GO:0006355///GO:0006979///GO:0006351	GO:0005623///GO:0005737///GO:0005737///GO:0005622///GO:0005758///GO:0005634
1453256_at	0.999989313241072	0.662563055058211	0.452843228419986	-4.74249509082718	0.170431475166617	Polr3c	polymerase (RNA) III (DNA directed) polypeptide C	74414	3 F2	DNA binding///DNA-directed RNA polymerase activity///contributes_to RNA polymerase III activity///nucleotidyltransferase activity///transferase activity	defense response to virus///immune system process///innate immune response///positive regulation of innate immune response///positive regulation of interferon-beta production///transcription, DNA-templated	DNA-directed RNA polymerase III complex///DNA-directed RNA polymerase III complex///nucleus	GO:0003677///GO:0003899///contributes_to GO:0001056///GO:0016779///GO:0016740	GO:0051607///GO:0002376///GO:0045087///GO:0045089///GO:0032728///GO:0006351	GO:0005666///GO:0005666///GO:0005634
1418654_at	0.999989313241072	0.707396175548213	0.388889731030506	-4.751377579832	0.353411730407165	Hao2	hydroxyacid oxidase 2	56185	3 42.9 cM	(S)-2-hydroxy-acid oxidase activity///FMN binding///catalytic activity///long-chain-(S)-2-hydroxy-long-chain-acid oxidase activity///medium-chain-(S)-2-hydroxy-acid oxidase activity///oxidoreductase activity///receptor binding///very-long-chain-(S)-2-hydroxy-acid oxidase activity	fatty acid oxidation///mandelate metabolic process///oxidation-reduction process///protein homooligomerization	extracellular vesicular exosome///mitochondrion///peroxisome	GO:0003973///GO:0010181///GO:0003824///GO:0052853///GO:0052854///GO:0016491///GO:0005102///GO:0052852	GO:0019395///GO:0018924///GO:0055114///GO:0051260	GO:0070062///GO:0005739///GO:0005777
1452995_at	0.999989313241072	0.713365266948635	-0.380511658501234	-4.75244783142954	-0.248880561542999	Nudt17	nudix (nucleoside diphosphate linked moiety X)-type motif 17	78373	3 F2	8-oxo-7,8-dihydroguanosine triphosphate pyrophosphatase activity///ATP-dependent 5'-3' DNA helicase activity///UDP-2,3-diacylglucosamine hydrolase activity///XTP diphosphatase activity///bis(5'-nucleosyl)-tetraphosphatase activity///dATP pyrophosphohydrolase activity///dITP diphosphatase activity///dTTP diphosphatase activity///dihydroneopterin monophosphate phosphatase activity///dihydroneopterin triphosphate pyrophosphohydrolase activity///hydrolase activity///metal ion binding///phosphocholine hydrolase activity///pyrophosphatase activity///thiamine-pyrophosphatase activity	biological_process	cellular_component	GO:0008413///GO:0043141///GO:0008758///GO:0036222///GO:0008796///GO:0008828///GO:0035870///GO:0036218///GO:0019176///GO:0019177///GO:0016787///GO:0046872///GO:0044606///GO:0016462///GO:0004787	GO:0008150	GO:0005575
