ID (num probes:22690)	adj.P.Val	P.Value	t	B	logFC	Gene.symbol	Gene.title	Gene.ID	Chromosome.location	GO.Function	GO.Process	GO.Component	GO.Function.ID	GO.Process.ID	GO.Component.ID
1449664_s_at	0.771788834005262	0.331585370507272	1.03466838437736	-5.6236752642576	0.224423910713529	Rnf20	ring finger protein 20	109331	4	UDP-N-acetylmuramoylalanyl-D-glutamyl-2,6-diaminopimelate-D-alanyl-D-alanine ligase activity///chromatin binding///coenzyme F420-0 gamma-glutamyl ligase activity///coenzyme F420-2 alpha-glutamyl ligase activity///histone binding///ligase activity///metal ion binding///p53 binding///protein binding///protein-glutamic acid ligase activity///protein-glycine ligase activity///protein-glycine ligase activity, elongating///protein-glycine ligase activity, initiating///ribosomal S6-glutamic acid ligase activity///transcription coactivator activity///tubulin-glutamic acid ligase activity///tubulin-glycine ligase activity///ubiquitin protein ligase binding///ubiquitin-protein transferase activity///contributes_to ubiquitin-protein transferase activity///zinc ion binding	chromatin modification///histone H2B ubiquitination///histone monoubiquitination///histone ubiquitination///negative regulation of cell migration///positive regulation of histone methylation///positive regulation of transcription, DNA-templated///protein polyubiquitination///regulation of transcription, DNA-templated///ubiquitin-dependent protein catabolic process	HULC complex///nucleus///ubiquitin ligase complex	GO:0008766///GO:0003682///GO:0043773///GO:0043774///GO:0042393///GO:0016874///GO:0046872///GO:0002039///GO:0005515///GO:0070739///GO:0070735///GO:0070737///GO:0070736///GO:0018169///GO:0003713///GO:0070740///GO:0070738///GO:0031625///GO:0004842///contributes_to GO:0004842///GO:0008270	GO:0016568///GO:0033523///GO:0010390///GO:0016574///GO:0030336///GO:0031062///GO:0045893///GO:0000209///GO:0006355///GO:0006511	GO:0033503///GO:0005634///GO:0000151
1434317_s_at	0.774941990546405	0.33750216312269	1.02128411033358	-5.63667650825239	0.107858240022836	Tex10	testis expressed gene 10	269536	4	molecular_function	biological_process	MLL1 complex///cytoplasm///integral component of membrane///membrane///nucleus	GO:0003674	GO:0008150	GO:0071339///GO:0005737///GO:0016021///GO:0016020///GO:0005634
1417395_at	0.779693678038966	0.34625685474705	-1.00180789259667	-5.65536650606738	-0.312405491974937	Klf4	Kruppel-like factor 4 (gut)	16600	4 29.76 cM	DNA binding///RNA polymerase II core promoter proximal region sequence-specific DNA binding transcription factor activity involved in positive regulation of transcription///RNA polymerase II core promoter proximal region sequence-specific DNA binding transcription factor activity involved in positive regulation of transcription///RNA polymerase II transcription factor binding///RNA polymerase II transcription factor binding///RNA polymerase II transcription factor binding transcription factor activity involved in positive regulation of transcription///core promoter proximal region sequence-specific DNA binding///double-stranded DNA binding///metal ion binding///nucleic acid binding///phosphatidylinositol 3-kinase regulator activity///sequence-specific DNA binding///sequence-specific DNA binding///sequence-specific DNA binding transcription factor activity///sequence-specific DNA binding transcription factor activity///sequence-specific DNA binding transcription factor recruiting transcription factor activity///transcription cofactor binding///transcription factor binding///transcription regulatory region DNA binding///transcription regulatory region DNA binding	cell differentiation///cellular response to growth factor stimulus///cellular response to laminar fluid shear stress///epidermal cell differentiation///epidermis morphogenesis///fat cell differentiation///negative regulation of ERK1 and ERK2 cascade///negative regulation of NF-kappaB transcription factor activity///negative regulation of cell migration involved in sprouting angiogenesis///negative regulation of cell proliferation///negative regulation of chemokine (C-X-C motif) ligand 2 production///negative regulation of cysteine-type endopeptidase activity involved in apoptotic process///negative regulation of heterotypic cell-cell adhesion///negative regulation of interleukin-8 biosynthetic process///negative regulation of muscle hyperplasia///negative regulation of phosphatidylinositol 3-kinase signaling///negative regulation of protein kinase B signaling///negative regulation of response to cytokine stimulus///negative regulation of smooth muscle cell proliferation///negative regulation of transcription from RNA polymerase II promoter///negative regulation of transcription, DNA-templated///negative regulation of transcription, DNA-templated///negative regulation of transcription, DNA-templated///positive regulation of cellular protein metabolic process///positive regulation of hemoglobin biosynthetic process///positive regulation of nitric oxide biosynthetic process///positive regulation of protein metabolic process///positive regulation of transcription from RNA polymerase II promoter///positive regulation of transcription from RNA polymerase II promoter///positive regulation of transcription from RNA polymerase II promoter///positive regulation of transcription, DNA-templated///post-embryonic camera-type eye development///post-embryonic hemopoiesis///regulation of cell differentiation///regulation of cell proliferation///regulation of phosphatidylinositol 3-kinase activity///regulation of transcription from RNA polymerase II promoter///regulation of transcription, DNA-templated///response to organic substance///response to retinoic acid///stem cell maintenance///transcription from RNA polymerase II promoter///transcription from RNA polymerase II promoter///transcription, DNA-templated	chromatin///nuclear chromatin///nucleus///nucleus///nucleus///transcription factor complex	GO:0003677///GO:0001077///GO:0001077///GO:0001085///GO:0001085///GO:0001190///GO:0000987///GO:0003690///GO:0046872///GO:0003676///GO:0035014///GO:0043565///GO:0043565///GO:0003700///GO:0003700///GO:0001010///GO:0001221///GO:0008134///GO:0044212///GO:0044212	GO:0030154///GO:0071363///GO:0071499///GO:0009913///GO:0048730///GO:0045444///GO:0070373///GO:0032088///GO:0090051///GO:0008285///GO:2000342///GO:0043154///GO:0034115///GO:0045415///GO:0014740///GO:0014067///GO:0051898///GO:0060761///GO:0048662///GO:0000122///GO:0045892///GO:0045892///GO:0045892///GO:0032270///GO:0046985///GO:0045429///GO:0051247///GO:0045944///GO:0045944///GO:0045944///GO:0045893///GO:0031077///GO:0035166///GO:0045595///GO:0042127///GO:0043551///GO:0006357///GO:0006355///GO:0010033///GO:0032526///GO:0019827///GO:0006366///GO:0006366///GO:0006351	GO:0000785///GO:0000790///GO:0005634///GO:0005634///GO:0005634///GO:0005667
1424222_s_at	0.779811194629783	0.346704950701862	1.0008212247349	-5.65630605881539	0.134000642984319	Rad23b	RAD23b homolog (S. cerevisiae)	19359	4 B3	damaged DNA binding///polyubiquitin binding///protein binding	DNA repair///cellular response to DNA damage stimulus///nucleotide-excision repair///nucleotide-excision repair, DNA damage recognition///proteasome-mediated ubiquitin-dependent protein catabolic process///regulation of proteasomal ubiquitin-dependent protein catabolic process///spermatogenesis	XPC complex///cytoplasm///nucleus///proteasome complex	GO:0003684///GO:0031593///GO:0005515	GO:0006281///GO:0006974///GO:0006289///GO:0000715///GO:0043161///GO:0032434///GO:0007283	GO:0071942///GO:0005737///GO:0005634///GO:0000502
1417394_at	0.798410720289756	0.383530723054034	-0.922832174086046	-5.72829082949433	-0.216711622473095	Klf4	Kruppel-like factor 4 (gut)	16600	4 29.76 cM	DNA binding///RNA polymerase II core promoter proximal region sequence-specific DNA binding transcription factor activity involved in positive regulation of transcription///RNA polymerase II core promoter proximal region sequence-specific DNA binding transcription factor activity involved in positive regulation of transcription///RNA polymerase II transcription factor binding///RNA polymerase II transcription factor binding///RNA polymerase II transcription factor binding transcription factor activity involved in positive regulation of transcription///core promoter proximal region sequence-specific DNA binding///double-stranded DNA binding///metal ion binding///nucleic acid binding///phosphatidylinositol 3-kinase regulator activity///sequence-specific DNA binding///sequence-specific DNA binding///sequence-specific DNA binding transcription factor activity///sequence-specific DNA binding transcription factor activity///sequence-specific DNA binding transcription factor recruiting transcription factor activity///transcription cofactor binding///transcription factor binding///transcription regulatory region DNA binding///transcription regulatory region DNA binding	cell differentiation///cellular response to growth factor stimulus///cellular response to laminar fluid shear stress///epidermal cell differentiation///epidermis morphogenesis///fat cell differentiation///negative regulation of ERK1 and ERK2 cascade///negative regulation of NF-kappaB transcription factor activity///negative regulation of cell migration involved in sprouting angiogenesis///negative regulation of cell proliferation///negative regulation of chemokine (C-X-C motif) ligand 2 production///negative regulation of cysteine-type endopeptidase activity involved in apoptotic process///negative regulation of heterotypic cell-cell adhesion///negative regulation of interleukin-8 biosynthetic process///negative regulation of muscle hyperplasia///negative regulation of phosphatidylinositol 3-kinase signaling///negative regulation of protein kinase B signaling///negative regulation of response to cytokine stimulus///negative regulation of smooth muscle cell proliferation///negative regulation of transcription from RNA polymerase II promoter///negative regulation of transcription, DNA-templated///negative regulation of transcription, DNA-templated///negative regulation of transcription, DNA-templated///positive regulation of cellular protein metabolic process///positive regulation of hemoglobin biosynthetic process///positive regulation of nitric oxide biosynthetic process///positive regulation of protein metabolic process///positive regulation of transcription from RNA polymerase II promoter///positive regulation of transcription from RNA polymerase II promoter///positive regulation of transcription from RNA polymerase II promoter///positive regulation of transcription, DNA-templated///post-embryonic camera-type eye development///post-embryonic hemopoiesis///regulation of cell differentiation///regulation of cell proliferation///regulation of phosphatidylinositol 3-kinase activity///regulation of transcription from RNA polymerase II promoter///regulation of transcription, DNA-templated///response to organic substance///response to retinoic acid///stem cell maintenance///transcription from RNA polymerase II promoter///transcription from RNA polymerase II promoter///transcription, DNA-templated	chromatin///nuclear chromatin///nucleus///nucleus///nucleus///transcription factor complex	GO:0003677///GO:0001077///GO:0001077///GO:0001085///GO:0001085///GO:0001190///GO:0000987///GO:0003690///GO:0046872///GO:0003676///GO:0035014///GO:0043565///GO:0043565///GO:0003700///GO:0003700///GO:0001010///GO:0001221///GO:0008134///GO:0044212///GO:0044212	GO:0030154///GO:0071363///GO:0071499///GO:0009913///GO:0048730///GO:0045444///GO:0070373///GO:0032088///GO:0090051///GO:0008285///GO:2000342///GO:0043154///GO:0034115///GO:0045415///GO:0014740///GO:0014067///GO:0051898///GO:0060761///GO:0048662///GO:0000122///GO:0045892///GO:0045892///GO:0045892///GO:0032270///GO:0046985///GO:0045429///GO:0051247///GO:0045944///GO:0045944///GO:0045944///GO:0045893///GO:0031077///GO:0035166///GO:0045595///GO:0042127///GO:0043551///GO:0006357///GO:0006355///GO:0010033///GO:0032526///GO:0019827///GO:0006366///GO:0006366///GO:0006351	GO:0000785///GO:0000790///GO:0005634///GO:0005634///GO:0005634///GO:0005667
1460725_at	0.799339228944845	0.386491943813418	0.916806855811632	-5.73366079624749	0.142260229155912	Xpa	xeroderma pigmentosum, complementation group A	22590	4 24.49 cM	DNA binding///damaged DNA binding///metal ion binding///protein domain specific binding///protein homodimerization activity	DNA repair///cellular response to DNA damage stimulus///intrinsic apoptotic signaling pathway in response to DNA damage///multicellular organism growth///nucleotide-excision repair///response to UV///response to oxidative stress///response to toxic substance	colocalizes_with DNA replication factor A complex///Golgi apparatus///cytoplasm///intercellular bridge///intracellular///nucleus///nucleus	GO:0003677///GO:0003684///GO:0046872///GO:0019904///GO:0042803	GO:0006281///GO:0006974///GO:0008630///GO:0035264///GO:0006289///GO:0009411///GO:0006979///GO:0009636	colocalizes_with GO:0005662///GO:0005794///GO:0005737///GO:0045171///GO:0005622///GO:0005634///GO:0005634
1424083_at	0.803124265111679	0.393598141385715	-0.902484027494034	-5.74631286009	-0.786539933772834	Ptbp3	polypyrimidine tract binding protein 3	230257	4	RNA binding///nucleic acid binding///nucleotide binding///poly(A) RNA binding	RNA splicing///cell differentiation///erythrocyte maturation///mRNA processing///negative regulation of RNA splicing///regulation of cell differentiation	nucleus	GO:0003723///GO:0003676///GO:0000166///GO:0044822	GO:0008380///GO:0030154///GO:0043249///GO:0006397///GO:0033119///GO:0045595	GO:0005634
1421268_at	0.803795706251427	0.396088135372288	0.897509872402751	-5.75066936065412	0.509849023705891	Ugcg	UDP-glucose ceramide glucosyltransferase	22234	4 32.44 cM	ceramide glucosyltransferase activity///transferase activity///transferase activity, transferring glycosyl groups	lipid metabolic process///sphingolipid metabolic process	Golgi apparatus///integral component of membrane///membrane	GO:0008120///GO:0016740///GO:0016757	GO:0006629///GO:0006665	GO:0005794///GO:0016021///GO:0016020
1460309_at	0.805039672538444	0.398380646018048	-0.892950212238352	-5.75464579343978	-0.572253397037645	Tal2	T cell acute lymphocytic leukemia 2	21350	4 28.75 cM	DNA binding///protein dimerization activity	midbrain development///multicellular organism growth///post-embryonic development///regulation of transcription, DNA-templated///thalamus development///transcription, DNA-templated		GO:0003677///GO:0046983	GO:0030901///GO:0035264///GO:0009791///GO:0006355///GO:0021794///GO:0006351	
1424700_at	0.806345193157151	0.401317263060112	-0.887137073702942	-5.75969164764077	-0.1028862565884	Tmem38b	transmembrane protein 38B	52076	4 28.76 cM	cation channel activity///potassium channel activity	ion transport///monovalent inorganic cation transport///potassium ion transmembrane transport///potassium ion transport///transport	endoplasmic reticulum///integral component of membrane///membrane///nucleus	GO:0005261///GO:0005267	GO:0006811///GO:0015672///GO:0071805///GO:0006813///GO:0006810	GO:0005783///GO:0016021///GO:0016020///GO:0005634
1416119_at	0.806900313556188	0.403416251960465	-0.883000803373891	-5.76326571913066	-0.095879780791817	Txn1	thioredoxin 1	22166	4 31.87 cM	enzyme binding///peptide disulfide oxidoreductase activity///poly(A) RNA binding///protein binding///protein disulfide oxidoreductase activity	cell redox homeostasis///glycerol ether metabolic process///negative regulation of protein export from nucleus///negative regulation of transcription from RNA polymerase II promoter///oxidation-reduction process///oxidation-reduction process///positive regulation of DNA binding///regulation of protein import into nucleus, translocation///regulation of transcription, DNA-templated///response to radiation///transcription, DNA-templated///transport	axon///cytoplasm///cytoplasm///cytosol///cytosol///dendrite///extracellular region///extracellular vesicular exosome///mitochondrion///neuronal cell body///nucleus///nucleus	GO:0019899///GO:0015037///GO:0044822///GO:0005515///GO:0015035	GO:0045454///GO:0006662///GO:0046826///GO:0000122///GO:0055114///GO:0055114///GO:0043388///GO:0033158///GO:0006355///GO:0009314///GO:0006351///GO:0006810	GO:0030424///GO:0005737///GO:0005737///GO:0005829///GO:0005829///GO:0030425///GO:0005576///GO:0070062///GO:0005739///GO:0043025///GO:0005634///GO:0005634
1427925_at	0.810797699430782	0.410486890129246	-0.869179958701214	-5.77510952412362	-0.170514166448928	Stx17	syntaxin 17	67727	4	SNAP receptor activity///SNAP receptor activity///SNARE binding///SNARE binding///protein kinase binding///protein phosphatase binding	ER to Golgi vesicle-mediated transport///Golgi organization///autophagic vacuole fusion///autophagy///endoplasmic reticulum-Golgi intermediate compartment organization///exocytosis///intracellular protein transport///protein localization to pre-autophagosomal structure///transport///vesicle-mediated transport	ER to Golgi transport vesicle///ER-mitochondrion membrane contact site///SNARE complex///SNARE complex///autophagic vacuole membrane///cytoplasm///cytoplasmic vesicle///cytosol///endoplasmic reticulum///endoplasmic reticulum membrane///endoplasmic reticulum-Golgi intermediate compartment///integral component of membrane///membrane///smooth endoplasmic reticulum membrane	GO:0005484///GO:0005484///GO:0000149///GO:0000149///GO:0019901///GO:0019903	GO:0006888///GO:0007030///GO:0000046///GO:0006914///GO:0097111///GO:0006887///GO:0006886///GO:0034497///GO:0006810///GO:0016192	GO:0030134///GO:0044233///GO:0031201///GO:0031201///GO:0000421///GO:0005737///GO:0031410///GO:0005829///GO:0005783///GO:0005789///GO:0005793///GO:0016021///GO:0016020///GO:0030868
1422689_at	0.821340135564518	0.426533192399587	0.838430582857664	-5.80091012834833	0.832073134743397	Toporsl	topoisomerase I binding, arginine/serine-rich like	68274	4	molecular_function	biological_process	cellular_component	GO:0003674	GO:0008150	GO:0005575
1419001_at	0.832417198919186	0.449626669545895	-0.795562968227064	-5.83558696875424	-0.165688930488235	Baat	bile acid-Coenzyme A: amino acid N-acyltransferase	12012	4 26.51 cM	N-acyltransferase activity///N-acyltransferase activity///carboxylic ester hydrolase activity///glycine N-choloyltransferase activity///hydrolase activity///long-chain acyl-CoA hydrolase activity///medium-chain acyl-CoA hydrolase activity///palmitoyl-CoA hydrolase activity///receptor binding///thiolester hydrolase activity///transferase activity///transferase activity, transferring acyl groups///very long chain acyl-CoA hydrolase activity	acyl-CoA metabolic process///bile acid biosynthetic process///bile acid conjugation///bile acid metabolic process///fatty acid metabolic process///glycine metabolic process///lipid metabolic process///taurine metabolic process	cytoplasm///cytosol///cytosol///peroxisome	GO:0016410///GO:0016410///GO:0052689///GO:0047963///GO:0016787///GO:0052816///GO:0052815///GO:0016290///GO:0005102///GO:0016790///GO:0016740///GO:0016746///GO:0052817	GO:0006637///GO:0006699///GO:0002152///GO:0008206///GO:0006631///GO:0006544///GO:0006629///GO:0019530	GO:0005737///GO:0005829///GO:0005829///GO:0005777
1421840_at	0.840426977540949	0.472771778708929	0.754077611927946	-5.86767756863801	0.117029953996365	Abca1	ATP-binding cassette, sub-family A (ABC1), member 1	11303	4 28.57 cM	ATP binding///ATPase activity///ATPase activity, coupled to transmembrane movement of substances///ATPase binding///anion transmembrane transporter activity///apolipoprotein A-I binding///apolipoprotein A-I receptor activity///apolipoprotein binding///cholesterol transporter activity///cholesterol transporter activity///cholesterol transporter activity///nucleotide binding///phospholipid transporter activity///phospholipid transporter activity///phospholipid transporter activity///protein binding///receptor binding///small GTPase binding///syntaxin binding	ATP catabolic process///G-protein coupled receptor signaling pathway///apolipoprotein A-I-mediated signaling pathway///cellular response to lipopolysaccharide///cellular response to retinoic acid///cholesterol efflux///cholesterol efflux///cholesterol efflux///cholesterol homeostasis///cholesterol metabolic process///cholesterol metabolic process///cholesterol transport///endosomal transport///high-density lipoprotein particle assembly///interleukin-1 beta secretion///intracellular cholesterol transport///ion transmembrane transport///lipoprotein biosynthetic process///lipoprotein biosynthetic process///lipoprotein metabolic process///lysosome organization///peptide secretion///phagocytosis, engulfment///phospholipid efflux///phospholipid efflux///phospholipid efflux///phospholipid homeostasis///phospholipid translocation///phospholipid transport///platelet dense granule organization///positive regulation of cAMP biosynthetic process///positive regulation of cholesterol efflux///protein lipidation///regulation of Cdc42 protein signal transduction///NOT response to high density lipoprotein particle///reverse cholesterol transport///reverse cholesterol transport///transmembrane transport///transport	Golgi apparatus///cell surface///endocytic vesicle///external side of plasma membrane///colocalizes_with high-density lipoprotein particle///integral component of membrane///integral component of plasma membrane///integral component of plasma membrane///intracellular membrane-bounded organelle///membrane///membrane raft///perinuclear region of cytoplasm///phagocytic vesicle///plasma membrane///plasma membrane	GO:0005524///GO:0016887///GO:0042626///GO:0051117///GO:0008509///GO:0034186///GO:0034188///GO:0034185///GO:0017127///GO:0017127///GO:0017127///GO:0000166///GO:0005548///GO:0005548///GO:0005548///GO:0005515///GO:0005102///GO:0031267///GO:0019905	GO:0006200///GO:0007186///GO:0038027///GO:0071222///GO:0071300///GO:0033344///GO:0033344///GO:0033344///GO:0042632///GO:0008203///GO:0008203///GO:0030301///GO:0016197///GO:0034380///GO:0050702///GO:0032367///GO:0034220///GO:0042158///GO:0042158///GO:0042157///GO:0007040///GO:0002790///GO:0006911///GO:0033700///GO:0033700///GO:0033700///GO:0055091///GO:0045332///GO:0015914///GO:0060155///GO:0030819///GO:0010875///GO:0006497///GO:0032489///NOT GO:0055099///GO:0043691///GO:0043691///GO:0055085///GO:0006810	GO:0005794///GO:0009986///GO:0030139///GO:0009897///colocalizes_with GO:0034364///GO:0016021///GO:0005887///GO:0005887///GO:0043231///GO:0016020///GO:0045121///GO:0048471///GO:0045335///GO:0005886///GO:0005886
1420930_s_at	0.848105031228666	0.487879834188779	0.727719578024266	-5.88729918881485	0.138550003617903	Ctnnal1	catenin (cadherin associated protein), alpha-like 1	54366	4 C1	actin filament binding///cadherin binding	Rho protein signal transduction///cell adhesion	cytoplasm///cytoskeleton///cytosol///membrane///plasma membrane	GO:0051015///GO:0045296	GO:0007266///GO:0007155	GO:0005737///GO:0005856///GO:0005829///GO:0016020///GO:0005886
