"ID (num probes:45101)"	"adj.P.Val"	"P.Value"	"t"	"B"	"logFC"	"Gene.symbol"	"Gene.title"	"Gene.ID"	"Chromosome.location"	"GO.Function"	"GO.Process"	"GO.Component"	"GO.Function.ID"	"GO.Process.ID"	"GO.Component.ID"
"1450192_at"	0.651037473241936	0.421800000623185	0.882089560753144	-6.84062006726981	0.00497964835121234	"Lhcgr"	"luteinizing hormone/choriogonadotropin receptor"	"16867"	"17 58.35 cM"	"ATPase binding///G-protein coupled peptide receptor activity///G-protein coupled receptor activity///choriogonadotropin hormone binding///choriogonadotropin hormone receptor activity///choriogonadotropin hormone receptor activity///identical protein binding///luteinizing hormone receptor activity///peptide hormone binding///protein homodimerization activity///protein-hormone receptor activity///signal transducer activity"	"G-protein coupled receptor signaling pathway///activation of adenylate cyclase activity///activation of adenylate cyclase activity///adenylate cyclase-modulating G-protein coupled receptor signaling pathway///arachidonic acid secretion///cellular response to gonadotropin stimulus///cognition///development of secondary male sexual characteristics///female gonad development///hormone-mediated signaling pathway///luteinizing hormone signaling pathway///luteinizing hormone signaling pathway///male gonad development///ovarian follicle development///ovulation cycle process///phospholipase C-activating G-protein coupled receptor signaling pathway///phospholipase C-activating G-protein coupled receptor signaling pathway///positive regulation of cAMP-mediated signaling///positive regulation of calcium ion transport into cytosol///positive regulation of calcium-mediated signaling///positive regulation of hormone biosynthetic process///positive regulation of inositol trisphosphate biosynthetic process///positive regulation of release of sequestered calcium ion into cytosol///protein targeting to lysosome///regulation of steroid hormone biosynthetic process///seminiferous tubule development///signal transduction///spermatogenesis///uterus development"	"cytoplasm///endoplasmic reticulum///endosome///extracellular space///integral component of membrane///integral component of plasma membrane///integral component of plasma membrane///intrinsic component of external side of plasma membrane///lysosome///membrane///nucleus///plasma membrane///receptor complex"	"GO:0051117///GO:0008528///GO:0004930///GO:0038106///GO:0035472///GO:0035472///GO:0042802///GO:0004964///GO:0017046///GO:0042803///GO:0016500///GO:0004871"	"GO:0007186///GO:0007190///GO:0007190///GO:0007188///GO:0050482///GO:0071371///GO:0050890///GO:0046544///GO:0008585///GO:0009755///GO:0042700///GO:0042700///GO:0008584///GO:0001541///GO:0022602///GO:0007200///GO:0007200///GO:0043950///GO:0010524///GO:0050850///GO:0046886///GO:0032962///GO:0051281///GO:0006622///GO:0090030///GO:0072520///GO:0007165///GO:0007283///GO:0060065"	"GO:0005737///GO:0005783///GO:0005768///GO:0005615///GO:0016021///GO:0005887///GO:0005887///GO:0031233///GO:0005764///GO:0016020///GO:0005634///GO:0005886///GO:0043235"
"1460411_s_at"	0.651300183671707	0.422281545219132	-0.881102478632353	-6.84152163949826	-0.282612621735106	"Pkdcc"	"protein kinase domain containing, cytoplasmic"	"106522"	"17 52.25 cM"	"ATP binding///kinase activity///nucleotide binding///protein kinase activity///transferase activity///transferase activity, transferring phosphorus-containing groups"	"bone mineralization///cell differentiation///embryonic digestive tract development///limb morphogenesis///lung alveolus development///multicellular organism growth///multicellular organismal development///negative regulation of Golgi to plasma membrane protein transport///ossification///palate development///phosphorylation///positive regulation of bone mineralization///positive regulation of chondrocyte differentiation///protein phosphorylation///protein transport///skeletal system development///transport"	"Golgi apparatus"	"GO:0005524///GO:0016301///GO:0000166///GO:0004672///GO:0016740///GO:0016772"	"GO:0030282///GO:0030154///GO:0048566///GO:0035108///GO:0048286///GO:0035264///GO:0007275///GO:0042997///GO:0001503///GO:0060021///GO:0016310///GO:0030501///GO:0032332///GO:0006468///GO:0015031///GO:0001501///GO:0006810"	"GO:0005794"
"1422414_a_at"	0.653568724187314	0.428650425965295	-0.868130578065991	-6.85330313651211	-0.162183244717006	"Calm2"	"calmodulin 2"	"12314"	"17"	"adenylate cyclase binding///calcium ion binding///calcium ion binding///calcium-dependent protein binding///enzyme regulator activity///ion channel binding///nitric-oxide synthase binding///nitric-oxide synthase regulator activity///phosphatidylinositol 3-kinase binding///protein N-terminus binding///protein domain specific binding///type 3 metabotropic glutamate receptor binding"	"G2/M transition of mitotic cell cycle///regulation of catalytic activity"	"cytoplasm///growth cone///neuron projection///nucleus///plasma membrane"	"GO:0008179///GO:0005509///GO:0005509///GO:0048306///GO:0030234///GO:0044325///GO:0050998///GO:0030235///GO:0043548///GO:0047485///GO:0019904///GO:0031800"	"GO:0000086///GO:0050790"	"GO:0005737///GO:0030426///GO:0043005///GO:0005634///GO:0005886"
"1436375_at"	0.657695944994569	0.437210796327225	0.850932218047182	-6.86872997633599	0.206281748418836	"Srbd1"	"S1 RNA binding domain 1"	"78586"	"17"	"RNA binding///molecular_function///nucleic acid binding"	"biological_process///nucleobase-containing compound metabolic process"	"cellular_component"	"GO:0003723///GO:0003674///GO:0003676"	"GO:0008150///GO:0006139"	"GO:0005575"
"1439359_x_at"	0.658365016527536	0.438471662308994	0.848421374206818	-6.87096353407338	0.00446133488940426	"Nrxn1"	"neurexin I"	"18189"	"17"	"acetylcholine receptor binding///calcium channel regulator activity///calcium ion binding///cell adhesion molecule binding///cell adhesion molecule binding///metal ion binding///neuroligin family protein binding///neuroligin family protein binding///protein binding///receptor binding"	"adult behavior///adult behavior///cell adhesion///gephyrin clustering///learning///learning///neuroligin clustering///neuromuscular process controlling balance///neurotransmitter secretion///neurotransmitter secretion///positive regulation of excitatory postsynaptic membrane potential///positive regulation of synapse assembly///positive regulation of synapse maturation///positive regulation of synaptic transmission, glutamatergic///postsynaptic density protein 95 clustering///postsynaptic membrane assembly///prepulse inhibition///protein heterotetramerization///regulation of grooming behavior///regulation of insulin secretion involved in cellular response to glucose stimulus///social behavior///synapse assembly///synaptic transmission///vesicle docking involved in exocytosis///vocal learning///vocalization behavior"	"cell///cell junction///cell surface///cell surface///endocytic vesicle///integral component of membrane///membrane///plasma membrane///plasma membrane///presynaptic membrane///synapse"	"GO:0033130///GO:0005246///GO:0005509///GO:0050839///GO:0050839///GO:0046872///GO:0097109///GO:0097109///GO:0005515///GO:0005102"	"GO:0030534///GO:0030534///GO:0007155///GO:0097116///GO:0007612///GO:0007612///GO:0097118///GO:0050885///GO:0007269///GO:0007269///GO:2000463///GO:0051965///GO:0090129///GO:0051968///GO:0097119///GO:0097104///GO:0060134///GO:0051290///GO:2000821///GO:0061178///GO:0035176///GO:0007416///GO:0007268///GO:0006904///GO:0042297///GO:0071625"	"GO:0005623///GO:0030054///GO:0009986///GO:0009986///GO:0030139///GO:0016021///GO:0016020///GO:0005886///GO:0005886///GO:0042734///GO:0045202"
"1442501_at"	0.660437844109809	0.444288307297964	0.836910503744964	-6.88114165114152	0.00511559572722131	"Nrxn1"	"neurexin I"	"18189"	"17"	"acetylcholine receptor binding///calcium channel regulator activity///calcium ion binding///cell adhesion molecule binding///cell adhesion molecule binding///metal ion binding///neuroligin family protein binding///neuroligin family protein binding///protein binding///receptor binding"	"adult behavior///adult behavior///cell adhesion///gephyrin clustering///learning///learning///neuroligin clustering///neuromuscular process controlling balance///neurotransmitter secretion///neurotransmitter secretion///positive regulation of excitatory postsynaptic membrane potential///positive regulation of synapse assembly///positive regulation of synapse maturation///positive regulation of synaptic transmission, glutamatergic///postsynaptic density protein 95 clustering///postsynaptic membrane assembly///prepulse inhibition///protein heterotetramerization///regulation of grooming behavior///regulation of insulin secretion involved in cellular response to glucose stimulus///social behavior///synapse assembly///synaptic transmission///vesicle docking involved in exocytosis///vocal learning///vocalization behavior"	"cell///cell junction///cell surface///cell surface///endocytic vesicle///integral component of membrane///membrane///plasma membrane///plasma membrane///presynaptic membrane///synapse"	"GO:0033130///GO:0005246///GO:0005509///GO:0050839///GO:0050839///GO:0046872///GO:0097109///GO:0097109///GO:0005515///GO:0005102"	"GO:0030534///GO:0030534///GO:0007155///GO:0097116///GO:0007612///GO:0007612///GO:0097118///GO:0050885///GO:0007269///GO:0007269///GO:2000463///GO:0051965///GO:0090129///GO:0051968///GO:0097119///GO:0097104///GO:0060134///GO:0051290///GO:2000821///GO:0061178///GO:0035176///GO:0007416///GO:0007268///GO:0006904///GO:0042297///GO:0071625"	"GO:0005623///GO:0030054///GO:0009986///GO:0009986///GO:0030139///GO:0016021///GO:0016020///GO:0005886///GO:0005886///GO:0042734///GO:0045202"
"1432263_a_at"	0.66076168311126	0.445025871800943	-0.83545926004673	-6.88241765338303	-0.0501624318346057	"Cox7a2l"	"cytochrome c oxidase subunit VIIa polypeptide 2-like"	"20463"	"17"	"cytochrome-c oxidase activity///electron carrier activity"	""	"membrane///mitochondrial inner membrane///mitochondrial respiratory chain///mitochondrion"	"GO:0004129///GO:0009055"	""	"GO:0016020///GO:0005743///GO:0005746///GO:0005739"
"1418426_at"	0.663003866233513	0.452239323325931	0.821362830545791	-6.89472704046814	0.00452472708146923	"Gtf2a1l"	"general transcription factor IIA, 1-like"	"71828"	"17 E5"	"DNA binding///protein binding"	"cognition///regulation of transcription, DNA-templated///transcription initiation from RNA polymerase II promoter///transcription, DNA-templated"	"cytoplasm///nucleus///transcription factor TFIIA complex"	"GO:0003677///GO:0005515"	"GO:0050890///GO:0006355///GO:0006367///GO:0006351"	"GO:0005737///GO:0005634///GO:0005672"
"1439358_a_at"	0.66699322119955	0.462837984863401	0.800959972923355	-6.91226733274386	0.00426369097093238	"Nrxn1"	"neurexin I"	"18189"	"17"	"acetylcholine receptor binding///calcium channel regulator activity///calcium ion binding///cell adhesion molecule binding///cell adhesion molecule binding///metal ion binding///neuroligin family protein binding///neuroligin family protein binding///protein binding///receptor binding"	"adult behavior///adult behavior///cell adhesion///gephyrin clustering///learning///learning///neuroligin clustering///neuromuscular process controlling balance///neurotransmitter secretion///neurotransmitter secretion///positive regulation of excitatory postsynaptic membrane potential///positive regulation of synapse assembly///positive regulation of synapse maturation///positive regulation of synaptic transmission, glutamatergic///postsynaptic density protein 95 clustering///postsynaptic membrane assembly///prepulse inhibition///protein heterotetramerization///regulation of grooming behavior///regulation of insulin secretion involved in cellular response to glucose stimulus///social behavior///synapse assembly///synaptic transmission///vesicle docking involved in exocytosis///vocal learning///vocalization behavior"	"cell///cell junction///cell surface///cell surface///endocytic vesicle///integral component of membrane///membrane///plasma membrane///plasma membrane///presynaptic membrane///synapse"	"GO:0033130///GO:0005246///GO:0005509///GO:0050839///GO:0050839///GO:0046872///GO:0097109///GO:0097109///GO:0005515///GO:0005102"	"GO:0030534///GO:0030534///GO:0007155///GO:0097116///GO:0007612///GO:0007612///GO:0097118///GO:0050885///GO:0007269///GO:0007269///GO:2000463///GO:0051965///GO:0090129///GO:0051968///GO:0097119///GO:0097104///GO:0060134///GO:0051290///GO:2000821///GO:0061178///GO:0035176///GO:0007416///GO:0007268///GO:0006904///GO:0042297///GO:0071625"	"GO:0005623///GO:0030054///GO:0009986///GO:0009986///GO:0030139///GO:0016021///GO:0016020///GO:0005886///GO:0005886///GO:0042734///GO:0045202"
"1459329_at"	0.670306191112166	0.471240070100296	0.785035457388163	-6.92572671742936	0.00422834175381537	"Ttc7"	"tetratricopeptide repeat domain 7"	"225049"	"17"	""	"cellular iron ion homeostasis///hemopoiesis"	"cell"	""	"GO:0006879///GO:0030097"	"GO:0005623"
"1420210_at"	0.672748715688064	0.476662521110476	0.7748708456785	-6.93421030336675	0.00417724054872215	"Slc8a1"	"solute carrier family 8 (sodium/calcium exchanger), member 1"	"20541"	"17 51.29 cM"	"ankyrin binding///ankyrin binding///antiporter activity///calcium:sodium antiporter activity///calcium:sodium antiporter activity///calcium:sodium antiporter activity///calcium:sodium antiporter activity involved in regulation of cardiac muscle cell membrane potential///calmodulin binding///cytoskeletal protein binding///ion channel binding///metal ion binding///protein binding"	"calcium ion export///calcium ion export///calcium ion homeostasis///calcium ion import///calcium ion import///calcium ion transmembrane transport///calcium ion transmembrane transport///calcium ion transport///calcium ion transport///calcium ion transport into cytosol///calcium ion transport into cytosol///cardiac muscle cell development///cardiac muscle contraction///cell communication///cell communication by electrical coupling involved in cardiac conduction///cellular calcium ion homeostasis///cellular response to cAMP///cellular response to caffeine///cellular response to reactive oxygen species///cellular sodium ion homeostasis///embryonic heart tube development///embryonic placenta development///heart morphogenesis///ion transport///muscle fiber development///negative regulation of cytosolic calcium ion concentration///positive regulation of cytosolic calcium ion concentration///positive regulation of fibroblast migration///post-embryonic development///regulation of calcium ion transport///regulation of cardiac muscle cell membrane potential///regulation of cardiac muscle contraction by regulation of the release of sequestered calcium ion///regulation of heart rate///regulation of sodium ion transport///regulation of the force of heart contraction///relaxation of smooth muscle///response to ATP///response to hypoxia///sodium ion export///sodium ion export///sodium ion import///sodium ion import///sodium ion transmembrane transport///sodium ion transport///sodium ion transport///transmembrane transport///transport///vascular smooth muscle contraction"	"T-tubule///T-tubule///Z disc///basolateral plasma membrane///cell///cell projection///cytosol///dendritic shaft///dendritic spine///integral component of membrane///integral component of plasma membrane///intercalated disc///intracellular///membrane///microtubule///mitochondrion///plasma membrane///plasma membrane///sarcolemma///sarcolemma"	"GO:0030506///GO:0030506///GO:0015297///GO:0005432///GO:0005432///GO:0005432///GO:0086038///GO:0005516///GO:0008092///GO:0044325///GO:0046872///GO:0005515"	"GO:1901660///GO:1901660///GO:0055074///GO:0070509///GO:0070509///GO:0070588///GO:0070588///GO:0006816///GO:0006816///GO:0060402///GO:0060402///GO:0055013///GO:0060048///GO:0007154///GO:0086064///GO:0006874///GO:0071320///GO:0071313///GO:0034614///GO:0006883///GO:0035050///GO:0001892///GO:0003007///GO:0006811///GO:0048747///GO:0051481///GO:0007204///GO:0010763///GO:0009791///GO:0051924///GO:0086036///GO:0010881///GO:0002027///GO:0002028///GO:0002026///GO:0044557///GO:0033198///GO:0001666///GO:0071436///GO:0071436///GO:0097369///GO:0097369///GO:0035725///GO:0006814///GO:0006814///GO:0055085///GO:0006810///GO:0014829"	"GO:0030315///GO:0030315///GO:0030018///GO:0016323///GO:0005623///GO:0042995///GO:0005829///GO:0043198///GO:0043197///GO:0016021///GO:0005887///GO:0014704///GO:0005622///GO:0016020///GO:0005874///GO:0005739///GO:0005886///GO:0005886///GO:0042383///GO:0042383"
"1450552_at"	0.672981559598829	0.477134838467709	0.773989549894543	-6.93494186681988	0.0041565073885077	"Atp6v1e2"	"ATPase, H+ transporting, lysosomal V1 subunit E2"	"74915"	"17"	"hydrogen-exporting ATPase activity, phosphorylative mechanism///proton-transporting ATPase activity, rotational mechanism"	"ATP catabolic process///ATP hydrolysis coupled proton transport///ion transport///proton transport///transport"	"acrosomal vesicle///proton-transporting two-sector ATPase complex, catalytic domain"	"GO:0008553///GO:0046961"	"GO:0006200///GO:0015991///GO:0006811///GO:0015992///GO:0006810"	"GO:0001669///GO:0033178"
"1437626_at"	0.675743700175988	0.485116283991445	0.759193695286137	-6.9471281670677	0.0195702251400398	"Zfp36l2"	"zinc finger protein 36, C3H type-like 2"	"12193"	"17"	"AU-rich element binding///DNA binding///RNA binding///mRNA 3'-UTR AU-rich region binding///metal ion binding///poly(A) RNA binding"	"T cell differentiation in thymus///definitive hemopoiesis///hemopoiesis///mRNA catabolic process///negative regulation of stem cell differentiation///nuclear-transcribed mRNA catabolic process, deadenylation-dependent decay///positive regulation of nuclear-transcribed mRNA catabolic process, deadenylation-dependent decay///regulation of mRNA stability///somatic stem cell division///somatic stem cell maintenance"	"cytoplasm///nucleus"	"GO:0017091///GO:0003677///GO:0003723///GO:0035925///GO:0046872///GO:0044822"	"GO:0033077///GO:0060216///GO:0030097///GO:0006402///GO:2000737///GO:0000288///GO:1900153///GO:0043488///GO:0048103///GO:0035019"	"GO:0005737///GO:0005634"
"1429740_at"	0.677109569251324	0.488097737833876	0.753712706018334	-6.95159628040961	0.00345803729981897	"Ttc7"	"tetratricopeptide repeat domain 7"	"225049"	"17"	""	"cellular iron ion homeostasis///hemopoiesis"	"cell"	""	"GO:0006879///GO:0030097"	"GO:0005623"
"1427597_at"	0.688620138469983	0.521812861186008	0.693351954363932	-6.9991073238069	0.00369770904986666	"Plekhh2"	"pleckstrin homology domain containing, family H (with MyTH4 domain) member 2"	"213556"	"17"	"actin binding///identical protein binding///protein binding"	"negative regulation of actin filament depolymerization"	"cell projection///cortical actin cytoskeleton///cytoplasm///cytoskeleton///lamellipodium///membrane///plasma membrane"	"GO:0003779///GO:0042802///GO:0005515"	"GO:0030835"	"GO:0042995///GO:0030864///GO:0005737///GO:0005856///GO:0030027///GO:0016020///GO:0005886"
"1431168_at"	0.690151240330811	0.525589779642189	0.68676385058384	-7.00410052000837	0.00354588110121146	"Six3os1"	"SIX homeobox 3, opposite strand 1"	"100043902"	"17"	"protein binding"	"regulation of photoreceptor cell differentiation///regulation of photoreceptor cell differentiation"	"cytoplasm///nucleus"	"GO:0005515"	"GO:0046532///GO:0046532"	"GO:0005737///GO:0005634"
"1437675_at"	0.694938245288019	0.537848703798665	-0.665603409305939	-7.01987521750271	-0.00473368283506437	"Slc8a1"	"solute carrier family 8 (sodium/calcium exchanger), member 1"	"20541"	"17 51.29 cM"	"ankyrin binding///ankyrin binding///antiporter activity///calcium:sodium antiporter activity///calcium:sodium antiporter activity///calcium:sodium antiporter activity///calcium:sodium antiporter activity involved in regulation of cardiac muscle cell membrane potential///calmodulin binding///cytoskeletal protein binding///ion channel binding///metal ion binding///protein binding"	"calcium ion export///calcium ion export///calcium ion homeostasis///calcium ion import///calcium ion import///calcium ion transmembrane transport///calcium ion transmembrane transport///calcium ion transport///calcium ion transport///calcium ion transport into cytosol///calcium ion transport into cytosol///cardiac muscle cell development///cardiac muscle contraction///cell communication///cell communication by electrical coupling involved in cardiac conduction///cellular calcium ion homeostasis///cellular response to cAMP///cellular response to caffeine///cellular response to reactive oxygen species///cellular sodium ion homeostasis///embryonic heart tube development///embryonic placenta development///heart morphogenesis///ion transport///muscle fiber development///negative regulation of cytosolic calcium ion concentration///positive regulation of cytosolic calcium ion concentration///positive regulation of fibroblast migration///post-embryonic development///regulation of calcium ion transport///regulation of cardiac muscle cell membrane potential///regulation of cardiac muscle contraction by regulation of the release of sequestered calcium ion///regulation of heart rate///regulation of sodium ion transport///regulation of the force of heart contraction///relaxation of smooth muscle///response to ATP///response to hypoxia///sodium ion export///sodium ion export///sodium ion import///sodium ion import///sodium ion transmembrane transport///sodium ion transport///sodium ion transport///transmembrane transport///transport///vascular smooth muscle contraction"	"T-tubule///T-tubule///Z disc///basolateral plasma membrane///cell///cell projection///cytosol///dendritic shaft///dendritic spine///integral component of membrane///integral component of plasma membrane///intercalated disc///intracellular///membrane///microtubule///mitochondrion///plasma membrane///plasma membrane///sarcolemma///sarcolemma"	"GO:0030506///GO:0030506///GO:0015297///GO:0005432///GO:0005432///GO:0005432///GO:0086038///GO:0005516///GO:0008092///GO:0044325///GO:0046872///GO:0005515"	"GO:1901660///GO:1901660///GO:0055074///GO:0070509///GO:0070509///GO:0070588///GO:0070588///GO:0006816///GO:0006816///GO:0060402///GO:0060402///GO:0055013///GO:0060048///GO:0007154///GO:0086064///GO:0006874///GO:0071320///GO:0071313///GO:0034614///GO:0006883///GO:0035050///GO:0001892///GO:0003007///GO:0006811///GO:0048747///GO:0051481///GO:0007204///GO:0010763///GO:0009791///GO:0051924///GO:0086036///GO:0010881///GO:0002027///GO:0002028///GO:0002026///GO:0044557///GO:0033198///GO:0001666///GO:0071436///GO:0071436///GO:0097369///GO:0097369///GO:0035725///GO:0006814///GO:0006814///GO:0055085///GO:0006810///GO:0014829"	"GO:0030315///GO:0030315///GO:0030018///GO:0016323///GO:0005623///GO:0042995///GO:0005829///GO:0043198///GO:0043197///GO:0016021///GO:0005887///GO:0014704///GO:0005622///GO:0016020///GO:0005874///GO:0005739///GO:0005886///GO:0005886///GO:0042383///GO:0042383"
"1448741_at"	0.696601795319178	0.543950571823754	-0.655193541585028	-7.02748670557795	-0.0882415051899494	"Slc3a1"	"solute carrier family 3, member 1"	"20532"	"17 55.17 cM"	"catalytic activity///cation binding///protein binding///protein heterodimerization activity"	"amino acid transport///carbohydrate metabolic process///transport"	"brush border membrane///brush border membrane///extracellular vesicular exosome///integral component of membrane///integral component of plasma membrane///membrane///mitochondrial inner membrane///plasma membrane///vacuolar membrane"	"GO:0003824///GO:0043169///GO:0005515///GO:0046982"	"GO:0006865///GO:0005975///GO:0006810"	"GO:0031526///GO:0031526///GO:0070062///GO:0016021///GO:0005887///GO:0016020///GO:0005743///GO:0005886///GO:0005774"
"1439564_at"	0.699203191294213	0.551273060003789	0.642804750560023	-7.03641558570824	0.00308097384559414	"Tmem247"	"transmembrane protein 247"	"78469"	"17"	"molecular_function"	"biological_process"	"endoplasmic reticulum///integral component of membrane///membrane"	"GO:0003674"	"GO:0008150"	"GO:0005783///GO:0016021///GO:0016020"
