"ID (num probes:45101)"	"adj.P.Val"	"P.Value"	"t"	"B"	"logFC"	"Gene.symbol"	"Gene.title"	"Gene.ID"	"Chromosome.location"	"GO.Function"	"GO.Process"	"GO.Component"	"GO.Function.ID"	"GO.Process.ID"	"GO.Component.ID"
"1418255_s_at"	0.985663745831382	0.860061128903973	-0.181352505532961	-5.73071387289753	-0.0848196506374883	"Srf"	"serum response factor"	"20807"	"17"	"DNA binding///DNA binding///RNA polymerase II core promoter proximal region sequence-specific DNA binding///RNA polymerase II core promoter proximal region sequence-specific DNA binding transcription factor activity involved in positive regulation of transcription///RNA polymerase II core promoter proximal region sequence-specific DNA binding transcription factor activity involved in positive regulation of transcription///contributes_to RNA polymerase II core promoter sequence-specific DNA binding transcription factor activity///RNA polymerase II distal enhancer sequence-specific DNA binding transcription factor activity///RNA polymerase II transcription factor binding transcription factor activity///RNA polymerase II transcription regulatory region sequence-specific DNA binding transcription factor activity involved in positive regulation of transcription///chromatin DNA binding///chromatin binding///protein binding///protein dimerization activity///protein homodimerization activity///sequence-specific DNA binding///sequence-specific DNA binding transcription factor activity///sequence-specific DNA binding transcription factor activity///serum response element binding///serum response element binding///transcription factor binding"	"actin cytoskeleton organization///actin filament organization///associative learning///cardiac myofibril assembly///cardiac vascular smooth muscle cell differentiation///cell migration involved in sprouting angiogenesis///cell migration involved in sprouting angiogenesis///cell-matrix adhesion///cellular senescence///contractile actin filament bundle assembly///developmental growth///dorsal aorta morphogenesis///epithelial cell-cell adhesion///epithelial structure maintenance///erythrocyte development///eyelid development in camera-type eye///gastrulation///heart development///heart looping///heart trabecula formation///hematopoietic stem cell differentiation///hippocampus development///in utero embryonic development///leukocyte differentiation///long term synaptic depression///long-term memory///mRNA transcription from RNA polymerase II promoter///megakaryocyte development///mesoderm formation///morphogenesis of an epithelial sheet///multicellular organismal development///muscle cell cellular homeostasis///negative regulation of beta-amyloid clearance///negative regulation of cell migration///negative regulation of cell proliferation///neuron migration///neuron projection development///patterning of blood vessels///platelet activation///platelet formation///positive regulation of axon extension///positive regulation of axon extension///positive regulation of cell differentiation///positive regulation of filopodium assembly///positive regulation of sequence-specific DNA binding transcription factor activity///positive regulation of smooth muscle contraction///positive regulation of transcription by glucose///positive regulation of transcription from RNA polymerase II promoter///positive regulation of transcription from RNA polymerase II promoter///positive regulation of transcription from RNA polymerase II promoter///positive regulation of transcription from RNA polymerase II promoter///positive regulation of transcription from RNA polymerase II promoter involved in myocardial precursor cell differentiation///positive regulation of transcription from RNA polymerase II promoter involved in myocardial precursor cell differentiation///positive regulation of transcription initiation from RNA polymerase II promoter///positive regulation of transcription via serum response element binding///positive regulation of transcription, DNA-templated///positive regulation of transcription, DNA-templated///positive thymic T cell selection///primitive streak formation///regulation of cell adhesion///regulation of transcription, DNA-templated///regulation of water loss via skin///response to cytokine///response to hormone///sarcomere organization///single organismal cell-cell adhesion///skin morphogenesis///stress fiber assembly///tangential migration from the subventricular zone to the olfactory bulb///tight junction assembly///transcription from RNA polymerase II promoter///transcription, DNA-templated///trophectodermal cell differentiation"	"cell///cytoplasm///nuclear chromatin///nucleus///nucleus///nucleus"	"GO:0003677///GO:0003677///GO:0000978///GO:0001077///GO:0001077///contributes_to GO:0000983///GO:0003705///GO:0001076///GO:0001228///GO:0031490///GO:0003682///GO:0005515///GO:0046983///GO:0042803///GO:0043565///GO:0003700///GO:0003700///GO:0010736///GO:0010736///GO:0008134"	"GO:0030036///GO:0007015///GO:0008306///GO:0055003///GO:0060947///GO:0002042///GO:0002042///GO:0007160///GO:0090398///GO:0030038///GO:0048589///GO:0035912///GO:0090136///GO:0010669///GO:0048821///GO:0061029///GO:0007369///GO:0007507///GO:0001947///GO:0060347///GO:0060218///GO:0021766///GO:0001701///GO:0002521///GO:0060292///GO:0007616///GO:0042789///GO:0035855///GO:0001707///GO:0002011///GO:0007275///GO:0046716///GO:1900222///GO:0030336///GO:0008285///GO:0001764///GO:0031175///GO:0001569///GO:0030168///GO:0030220///GO:0045773///GO:0045773///GO:0045597///GO:0051491///GO:0051091///GO:0045987///GO:0046016///GO:0045944///GO:0045944///GO:0045944///GO:0045944///GO:0003257///GO:0003257///GO:0060261///GO:0010735///GO:0045893///GO:0045893///GO:0045059///GO:0090009///GO:0030155///GO:0006355///GO:0033561///GO:0034097///GO:0009725///GO:0045214///GO:0016337///GO:0043589///GO:0043149///GO:0022028///GO:0070830///GO:0006366///GO:0006351///GO:0001829"	"GO:0005623///GO:0005737///GO:0000790///GO:0005634///GO:0005634///GO:0005634"
"1417039_a_at"	0.986760016850592	0.872585172793057	-0.164949803541903	-5.73354072932854	-0.0771995996809363	"Cul7"	"cullin 7"	"66515"	"17"	"protein binding///ubiquitin protein ligase binding"	"Golgi organization///apoptotic process///epithelial to mesenchymal transition///microtubule cytoskeleton organization///mitotic cytokinesis///placenta development///positive regulation of dendrite morphogenesis///protein ubiquitination///regulation of apoptotic process///regulation of endothelial cell differentiation///regulation of mitosis///ubiquitin-dependent protein catabolic process///vasculogenesis"	"3M complex///Cul7-RING ubiquitin ligase complex///Cul7-RING ubiquitin ligase complex///Golgi apparatus///centrosome///cullin-RING ubiquitin ligase complex///cytoplasm///cytoskeleton///intracellular///nucleus///perinuclear region of cytoplasm"	"GO:0005515///GO:0031625"	"GO:0007030///GO:0006915///GO:0001837///GO:0000226///GO:0000281///GO:0001890///GO:0050775///GO:0016567///GO:0042981///GO:0045601///GO:0007088///GO:0006511///GO:0001570"	"GO:1990393///GO:0031467///GO:0031467///GO:0005794///GO:0005813///GO:0031461///GO:0005737///GO:0005856///GO:0005622///GO:0005634///GO:0048471"
"1450742_at"	0.986760016850592	0.872664938024485	0.164845497606885	-5.73355785453455	0.0655720505962902	"Bysl"	"bystin-like"	"53414"	"17 23.63 cM"	"poly(A) RNA binding"	"blastocyst formation///cell adhesion///cell proliferation///in utero embryonic development///maturation of SSU-rRNA from tricistronic rRNA transcript (SSU-rRNA, 5.8S rRNA, LSU-rRNA)///ribosome biogenesis///trophectodermal cell differentiation"	"apical part of cell///cell projection///cytoplasm///cytoplasm///cytoplasmic microtubule///intracellular membrane-bounded organelle///membrane///nucleolus///nucleolus///nucleus///perinuclear region of cytoplasm"	"GO:0044822"	"GO:0001825///GO:0007155///GO:0008283///GO:0001701///GO:0000462///GO:0042254///GO:0001829"	"GO:0045177///GO:0042995///GO:0005737///GO:0005737///GO:0005881///GO:0043231///GO:0016020///GO:0005730///GO:0005730///GO:0005634///GO:0048471"
"1439277_at"	0.986993503142295	0.874473517932785	0.162481017011241	-5.73394317350623	0.199560270502696	"Frs3os"	"fibroblast growth factor receptor substrate 3, opposite strand"	"100126242"	"17"	""	""	""	""	""	""
"1416690_at"	0.989272228854976	0.895705095087371	0.134794562671219	-5.73804300028423	0.0568437360919951	"Gtpbp2"	"GTP binding protein 2"	"56055"	"17 C-D"	"GTP binding///GTPase activity///nucleotide binding///protein binding"	"nuclear-transcribed mRNA catabolic process, no-go decay///rescue of stalled ribosome"	"intracellular membrane-bounded organelle"	"GO:0005525///GO:0003924///GO:0000166///GO:0005515"	"GO:0070966///GO:0072344"	"GO:0043231"
"1426479_a_at"	0.991879312917198	0.918234122643286	0.105540315137309	-5.74154845167562	0.0339637119764618	"Cnpy3"	"canopy 3 homolog (zebrafish)"	"72029"	"17 C"	"receptor binding"	"immune system process///innate immune response"	"endoplasmic reticulum"	"GO:0005102"	"GO:0002376///GO:0045087"	"GO:0005783"
"1415991_a_at"	0.991889329155221	0.926994058438685	-0.0941939131599441	-5.7426790081298	-0.0509714459223201	"Klhdc3"	"kelch domain containing 3"	"71765"	"17 22.9 cM"	"chromatin binding"	"biological_process///meiotic nuclear division"	"cytoplasm///cytoplasm///nuclear chromatin///nuclear chromatin"	"GO:0003682"	"GO:0008150///GO:0007126"	"GO:0005737///GO:0005737///GO:0000790///GO:0000790"
"1425441_at"	0.99418841512287	0.947505152689475	0.0676763629805379	-5.74482117786627	0.100149325242916	"Guca1b"	"guanylate cyclase activator 1B"	"107477"	"17"	"calcium ion binding///calcium sensitive guanylate cyclase activator activity///guanylate cyclase regulator activity///metal ion binding"	"phototransduction///positive regulation of guanylate cyclase activity///regulation of guanylate cyclase activity///response to stimulus///visual perception"	"membrane///photoreceptor inner segment///photoreceptor outer segment///plasma membrane"	"GO:0005509///GO:0008048///GO:0030249///GO:0046872"	"GO:0007602///GO:0031284///GO:0031282///GO:0050896///GO:0007601"	"GO:0016020///GO:0001917///GO:0001750///GO:0005886"
"1417108_at"	0.99418841512287	0.948581544314174	0.0662863980253676	-5.7449141298437	0.0276876137401594	"Klc4"	"kinesin light chain 4"	"74764"	"17"	"microtubule motor activity///molecular_function"	"biological_process"	"cellular_component///cytoplasm///cytoskeleton///kinesin complex///microtubule"	"GO:0003777///GO:0003674"	"GO:0008150"	"GO:0005575///GO:0005737///GO:0005856///GO:0005871///GO:0005874"
"1429516_at"	0.994429146981661	0.953746366850534	-0.0596188875554213	-5.74533321785364	-0.023141617063148	"Ubr2"	"ubiquitin protein ligase E3 component n-recognin 2"	"224826"	"17"	"UDP-N-acetylmuramoylalanyl-D-glutamyl-2,6-diaminopimelate-D-alanyl-D-alanine ligase activity///coenzyme F420-0 gamma-glutamyl ligase activity///coenzyme F420-2 alpha-glutamyl ligase activity///leucine binding///ligase activity///metal ion binding///protein binding///protein-glutamic acid ligase activity///protein-glycine ligase activity///protein-glycine ligase activity, elongating///protein-glycine ligase activity, initiating///ribosomal S6-glutamic acid ligase activity///tubulin-glutamic acid ligase activity///tubulin-glycine ligase activity///ubiquitin-protein transferase activity///ubiquitin-protein transferase activity///zinc ion binding"	"cellular response to leucine///chromatin silencing///histone H2A ubiquitination///male meiosis I///negative regulation of TOR signaling///protein catabolic process///protein ubiquitination///spermatogenesis///ubiquitin-dependent protein catabolic process"	"colocalizes_with chromatin///nucleus///plasma membrane///ubiquitin ligase complex"	"GO:0008766///GO:0043773///GO:0043774///GO:0070728///GO:0016874///GO:0046872///GO:0005515///GO:0070739///GO:0070735///GO:0070737///GO:0070736///GO:0018169///GO:0070740///GO:0070738///GO:0004842///GO:0004842///GO:0008270"	"GO:0071233///GO:0006342///GO:0033522///GO:0007141///GO:0032007///GO:0030163///GO:0016567///GO:0007283///GO:0006511"	"colocalizes_with GO:0000785///GO:0005634///GO:0005886///GO:0000151"
"1416826_a_at"	0.995692498992568	0.964013514479602	-0.0463729522125951	-5.74603420719555	-0.0153112956092851	"Med20"	"mediator complex subunit 20"	"56771"	"17"	"RNA polymerase II transcription cofactor activity///protein binding"	"regulation of transcription from RNA polymerase II promoter///regulation of transcription, DNA-templated///skeletal muscle cell differentiation///transcription, DNA-templated"	"mediator complex///nucleus"	"GO:0001104///GO:0005515"	"GO:0006357///GO:0006355///GO:0035914///GO:0006351"	"GO:0016592///GO:0005634"
