"ID (num probes:45101)"	"adj.P.Val"	"P.Value"	"t"	"B"	"logFC"	"Gene.symbol"	"Gene.title"	"Gene.ID"	"Chromosome.location"	"GO.Function"	"GO.Process"	"GO.Component"	"GO.Function.ID"	"GO.Process.ID"	"GO.Component.ID"
"1418706_at"	0.999848934610288	0.576761130229834	0.5689863856013	-4.82341098577825	0.175417918556104	"Slc38a3"	"solute carrier family 38, member 3"	"76257"	"9 58.69 cM"	"L-alanine transmembrane transporter activity///L-asparagine transmembrane transporter activity///L-glutamine transmembrane transporter activity///L-glutamine transmembrane transporter activity///L-histidine transmembrane transporter activity///L-histidine transmembrane transporter activity///antiporter activity///symporter activity"	"L-alanine transport///L-alpha-amino acid transmembrane transport///amino acid transport///asparagine transport///cation transmembrane transport///drug transmembrane transport///glutamine transport///glutamine transport///histidine transport///histidine transport///ion transport///sodium ion transport///transport"	"integral component of membrane///integral component of plasma membrane///integral component of plasma membrane///membrane///plasma membrane"	"GO:0015180///GO:0015182///GO:0015186///GO:0015186///GO:0005290///GO:0005290///GO:0015297///GO:0015293"	"GO:0015808///GO:1902475///GO:0006865///GO:0006867///GO:0098655///GO:0006855///GO:0006868///GO:0006868///GO:0015817///GO:0015817///GO:0006811///GO:0006814///GO:0006810"	"GO:0016021///GO:0005887///GO:0005887///GO:0016020///GO:0005886"
"1420124_s_at"	0.999848934610288	0.60026381405989	-0.533925868853691	-4.83251568039145	-0.0664268940795378	"Tcta"	"T cell leukemia translocation altered gene"	"102791"	"9 59.2 cM"	""	""	"integral component of membrane///membrane"	""	""	"GO:0016021///GO:0016020"
"1457788_at"	0.999848934610288	0.606987618203952	-0.524021818249452	-4.83498815511524	-0.0996167696193029	"Rassf1"	"Ras association (RalGDS/AF-6) domain family member 1"	"56289"	"9"	"identical protein binding///metal ion binding///protein N-terminus binding///protein binding"	"Ras protein signal transduction///cell cycle///cell cycle arrest///cellular response to DNA damage stimulus///intracellular signal transduction///negative regulation of cell cycle arrest///positive regulation of protein ubiquitination///protein stabilization///signal transduction"	"cytoplasm///cytoskeleton///microtubule///microtubule cytoskeleton///nucleus///plasma membrane"	"GO:0042802///GO:0046872///GO:0047485///GO:0005515"	"GO:0007265///GO:0007049///GO:0007050///GO:0006974///GO:0035556///GO:0071157///GO:0031398///GO:0050821///GO:0007165"	"GO:0005737///GO:0005856///GO:0005874///GO:0015630///GO:0005634///GO:0005886"
"1422750_a_at"	0.999848934610288	0.61577141568581	0.511163432414488	-4.83813241997516	0.0643207083864621	"Zmynd10"	"zinc finger, MYND domain containing 10"	"114602"	"9"	"metal ion binding///molecular_function"	"inner dynein arm assembly///motile cilium assembly///outer dynein arm assembly"	"centriolar satellite///cytoplasm///cytoskeleton"	"GO:0046872///GO:0003674"	"GO:0036159///GO:0044458///GO:0036158"	"GO:0034451///GO:0005737///GO:0005856"
"1425877_at"	0.999848934610288	0.617158745395494	0.50914064221507	-4.83862027670614	0.0494047768485346	"Hyal3"	"hyaluronoglucosaminidase 3"	"109685"	"9 58.19 cM"	"catalytic activity///hyaluronoglucuronidase activity///hyalurononglucosaminidase activity///hydrolase activity///hydrolase activity, acting on glycosyl bonds///NOT virus receptor activity"	"carbohydrate metabolic process///cellular response to UV-B///cellular response to interleukin-1///hyaluronan catabolic process///inflammatory response///metabolic process///response to virus///response to virus"	"cytoplasmic vesicle///extracellular region///lysosome"	"GO:0003824///GO:0033906///GO:0004415///GO:0016787///GO:0016798///NOT GO:0001618"	"GO:0005975///GO:0071493///GO:0071347///GO:0030214///GO:0006954///GO:0008152///GO:0009615///GO:0009615"	"GO:0031410///GO:0005576///GO:0005764"
"1431795_a_at"	0.999848934610288	0.620962368091803	0.503605877082508	-4.83994571689132	0.0933469023291174	"Sema3b"	"sema domain, immunoglobulin domain (Ig), short basic domain, secreted, (semaphorin) 3B"	"20347"	"9 58.31 cM"	"receptor activity"	"cell differentiation///multicellular organismal development///nervous system development"	"extracellular region///extracellular vesicular exosome///membrane"	"GO:0004872"	"GO:0030154///GO:0007275///GO:0007399"	"GO:0005576///GO:0070062///GO:0016020"
"1422023_at"	0.999848934610288	0.630580432897918	-0.48968132782949	-4.84321906542703	-0.0384629367213744	"Bsn"	"bassoon"	"12217"	"9 59.07 cM"	"metal ion binding///protein binding"	""	"axon///cell junction///cytoplasm///cytoskeleton///dendrite///excitatory synapse///extrinsic component of membrane///NOT integral component of membrane///neuron projection///neuron projection terminus///postsynaptic density///presynaptic active zone///presynaptic active zone///synapse///synapse"	"GO:0046872///GO:0005515"	""	"GO:0030424///GO:0030054///GO:0005737///GO:0005856///GO:0030425///GO:0060076///GO:0019898///NOT GO:0016021///GO:0043005///GO:0044306///GO:0014069///GO:0048786///GO:0048786///GO:0045202///GO:0045202"
"1419531_at"	0.999848934610288	0.631352907064188	-0.488567302622597	-4.84347715430656	-0.0458414529095002	"1700102P08Rik"	"RIKEN cDNA 1700102P08 gene"	"112418"	"9"	"molecular_function"	"biological_process"	"cellular_component"	"GO:0003674"	"GO:0008150"	"GO:0005575"
"1435652_a_at"	0.999848934610288	0.633388014142835	-0.485635391877747	-4.8441537067948	-0.0689288660145472	"Gnai2"	"guanine nucleotide binding protein (G protein), alpha inhibiting 2"	"14678"	"9 58.43 cM"	"G-protein beta/gamma-subunit complex binding///G-protein coupled receptor binding///GTP binding///GTPase activity///guanyl nucleotide binding///metal ion binding///nucleotide binding///protein binding///signal transducer activity"	"G-protein coupled acetylcholine receptor signaling pathway///G-protein coupled receptor signaling pathway///GTP catabolic process///activation of MAPKK activity///adenosine receptor signaling pathway///adenosine receptor signaling pathway///adenylate cyclase-inhibiting G-protein coupled receptor signaling pathway///adenylate cyclase-inhibiting G-protein coupled receptor signaling pathway///adenylate cyclase-modulating G-protein coupled receptor signaling pathway///cell cycle///cell division///cell proliferation///gamma-aminobutyric acid signaling pathway///gamma-aminobutyric acid signaling pathway///intracellular signal transduction///negative regulation of synaptic transmission///positive regulation of cell proliferation///regulation of calcium ion transport///NOT regulation of heart contraction///signal transduction"	"centrosome///cytoplasm///cytoskeleton///cytosol///extracellular vesicular exosome///heterotrimeric G-protein complex///membrane///membrane raft///midbody///nucleus///plasma membrane///vesicle"	"GO:0031683///GO:0001664///GO:0005525///GO:0003924///GO:0019001///GO:0046872///GO:0000166///GO:0005515///GO:0004871"	"GO:0007213///GO:0007186///GO:0006184///GO:0000186///GO:0001973///GO:0001973///GO:0007193///GO:0007193///GO:0007188///GO:0007049///GO:0051301///GO:0008283///GO:0007214///GO:0007214///GO:0035556///GO:0050805///GO:0008284///GO:0051924///NOT GO:0008016///GO:0007165"	"GO:0005813///GO:0005737///GO:0005856///GO:0005829///GO:0070062///GO:0005834///GO:0016020///GO:0045121///GO:0030496///GO:0005634///GO:0005886///GO:0031982"
"1437317_at"	0.999848934610288	0.636215572813936	0.481569038347583	-4.84508557886442	0.0512264060396001	"Uba7"	"ubiquitin-like modifier activating enzyme 7"	"74153"	"9 59.07 cM"	"ISG15 activating enzyme activity///ISG15 activating enzyme activity///ubiquitin activating enzyme activity///ubiquitin-protein transferase activity"	"ISG15-protein conjugation///ISG15-protein conjugation///cellular protein modification process///modification-dependent protein catabolic process///protein ubiquitination"	"cytosol///nucleus"	"GO:0019782///GO:0019782///GO:0004839///GO:0004842"	"GO:0032020///GO:0032020///GO:0006464///GO:0019941///GO:0016567"	"GO:0005829///GO:0005634"
"1420708_at"	0.999848934610288	0.643040480041294	0.471788032017223	-4.84729627372111	0.0352320384373571	"Traip"	"TRAF-interacting protein"	"22036"	"9 59.07 cM"	"UDP-N-acetylmuramoylalanyl-D-glutamyl-2,6-diaminopimelate-D-alanyl-D-alanine ligase activity///coenzyme F420-0 gamma-glutamyl ligase activity///coenzyme F420-2 alpha-glutamyl ligase activity///ligase activity///metal ion binding///protein binding///protein-glutamic acid ligase activity///protein-glycine ligase activity///protein-glycine ligase activity, elongating///protein-glycine ligase activity, initiating///receptor signaling protein activity///ribosomal S6-glutamic acid ligase activity///tubulin-glutamic acid ligase activity///tubulin-glycine ligase activity///ubiquitin-protein transferase activity///zinc ion binding"	"intracellular signal transduction///protein ubiquitination///signal transduction///signal transduction"	"cytoplasm///nucleus"	"GO:0008766///GO:0043773///GO:0043774///GO:0016874///GO:0046872///GO:0005515///GO:0070739///GO:0070735///GO:0070737///GO:0070736///GO:0005057///GO:0018169///GO:0070740///GO:0070738///GO:0004842///GO:0008270"	"GO:0035556///GO:0016567///GO:0007165///GO:0007165"	"GO:0005737///GO:0005634"
"1438812_x_at"	0.999848934610288	0.653514560882965	0.456868078579747	-4.85058449640716	0.0492623670936225	"Usp19"	"ubiquitin specific peptidase 19"	"71472"	"9"	"cysteine-type peptidase activity///hydrolase activity///metal ion binding///peptidase activity///ubiquitin-specific protease activity///ubiquitin-specific protease activity///ubiquitinyl hydrolase activity"	"ER-associated ubiquitin-dependent protein catabolic process///negative regulation of skeletal muscle tissue development///positive regulation of cell cycle process///protein deubiquitination///proteolysis///regulation of cellular response to hypoxia///regulation of protein stability///ubiquitin-dependent protein catabolic process"	"cytosol///endoplasmic reticulum///endoplasmic reticulum membrane///integral component of membrane///membrane"	"GO:0008234///GO:0016787///GO:0046872///GO:0008233///GO:0004843///GO:0004843///GO:0036459"	"GO:0030433///GO:0048642///GO:0090068///GO:0016579///GO:0006508///GO:1900037///GO:0031647///GO:0006511"	"GO:0005829///GO:0005783///GO:0005789///GO:0016021///GO:0016020"
"1448415_a_at"	0.999848934610288	0.658787468120998	0.449397276432189	-4.85219277497472	0.118752772481754	"Sema3b"	"sema domain, immunoglobulin domain (Ig), short basic domain, secreted, (semaphorin) 3B"	"20347"	"9 58.31 cM"	"receptor activity"	"cell differentiation///multicellular organismal development///nervous system development"	"extracellular region///extracellular vesicular exosome///membrane"	"GO:0004872"	"GO:0030154///GO:0007275///GO:0007399"	"GO:0005576///GO:0070062///GO:0016020"
"1426289_at"	0.999848934610288	0.662833652413319	-0.443682291668821	-4.85340581234261	-0.0381935084943556	"Qrich1"	"glutamine-rich 1"	"69232"	"9"	"molecular_function"	"biological_process"	"nucleus"	"GO:0003674"	"GO:0008150"	"GO:0005634"
"1439669_at"	0.999848934610288	0.667150694568261	0.437601406634385	-4.85468006178069	0.254973002024981	"6430571L13Rik"	"RIKEN cDNA 6430571L13 gene"	"235599"	"9"	"molecular_function"	"biological_process"	"cellular_component///integral component of membrane///membrane"	"GO:0003674"	"GO:0008150"	"GO:0005575///GO:0016021///GO:0016020"
"1456726_x_at"	0.999848934610288	0.672361948302947	0.430283427517704	-4.85619101986585	0.0353824808621676	"Qars"	"glutaminyl-tRNA synthetase"	"97541"	"9"	"ATP binding///RNA binding///aminoacyl-tRNA ligase activity///glutamine-tRNA ligase activity///ligase activity///nucleotide binding///protein kinase binding"	"negative regulation of apoptotic process///translation"	"aminoacyl-tRNA synthetase multienzyme complex"	"GO:0005524///GO:0003723///GO:0004812///GO:0004819///GO:0016874///GO:0000166///GO:0019901"	"GO:0043066///GO:0006412"	"GO:0017101"
"1417213_a_at"	0.999848934610288	0.68257148081444	-0.416015742645737	-4.85906599618847	-0.0782237693080769	"Rbm6"	"RNA binding motif protein 6"	"19654"	"9 F1-F2"	"poly(A) RNA binding"	""	"nucleus"	"GO:0044822"	""	"GO:0005634"
"1449377_at"	0.999848934610288	0.704421477203112	-0.385771947467664	-4.86484906270574	-0.060196508050345	"Nicn1"	"nicolin 1"	"66257"	"9"	"molecular_function"	"biological_process"	"cellular_component///microtubule///nucleus"	"GO:0003674"	"GO:0008150"	"GO:0005575///GO:0005874///GO:0005634"
"1460212_at"	0.999848934610288	0.710329073914061	-0.377659281516805	-4.86632812925445	-0.0275684999434148	"Gnat1"	"guanine nucleotide binding protein, alpha transducing 1"	"14685"	"9 58.86 cM"	"G-protein beta/gamma-subunit complex binding///G-protein coupled receptor binding///GTP binding///GTPase activity///GTPase activity///GTPase activity///guanyl nucleotide binding///metal ion binding///nucleotide binding///protein binding///signal transducer activity"	"G-protein coupled receptor signaling pathway///G-protein coupled receptor signaling pathway///G-protein coupled receptor signaling pathway coupled to cGMP nucleotide second messenger///GTP catabolic process///adenylate cyclase-modulating G-protein coupled receptor signaling pathway///cell proliferation///cellular response to electrical stimulus///detection of chemical stimulus involved in sensory perception of bitter taste///detection of light stimulus involved in visual perception///detection of light stimulus involved in visual perception///eye photoreceptor cell development///phototransduction///phototransduction, visible light///positive regulation of cyclic-nucleotide phosphodiesterase activity///response to light intensity///response to stimulus///retina development in camera-type eye///rhodopsin mediated signaling pathway///sensory perception of umami taste///signal transduction///visual perception///visual perception"	"apical plasma membrane///cytoplasm///heterotrimeric G-protein complex///heterotrimeric G-protein complex///heterotrimeric G-protein complex///heterotrimeric G-protein complex///heterotrimeric G-protein complex///membrane///neuronal cell body///photoreceptor connecting cilium///photoreceptor inner segment///photoreceptor outer segment///photoreceptor outer segment"	"GO:0031683///GO:0001664///GO:0005525///GO:0003924///GO:0003924///GO:0003924///GO:0019001///GO:0046872///GO:0000166///GO:0005515///GO:0004871"	"GO:0007186///GO:0007186///GO:0007199///GO:0006184///GO:0007188///GO:0008283///GO:0071257///GO:0001580///GO:0050908///GO:0050908///GO:0042462///GO:0007602///GO:0007603///GO:0051343///GO:0009642///GO:0050896///GO:0060041///GO:0016056///GO:0050917///GO:0007165///GO:0007601///GO:0007601"	"GO:0016324///GO:0005737///GO:0005834///GO:0005834///GO:0005834///GO:0005834///GO:0005834///GO:0016020///GO:0043025///GO:0032391///GO:0001917///GO:0001750///GO:0001750"
"1424068_at"	0.999848934610288	0.713624963354408	-0.373144516976133	-4.86713797470961	-0.0511776974173426	"Tcta"	"T cell leukemia translocation altered gene"	"102791"	"9 59.2 cM"	""	""	"integral component of membrane///membrane"	""	""	"GO:0016021///GO:0016020"
"1453237_at"	0.999848934610288	0.715085898989176	-0.371145859996318	-4.86749345549182	-0.0402678391022922	"Qars"	"glutaminyl-tRNA synthetase"	"97541"	"9"	"ATP binding///RNA binding///aminoacyl-tRNA ligase activity///glutamine-tRNA ligase activity///ligase activity///nucleotide binding///protein kinase binding"	"negative regulation of apoptotic process///translation"	"aminoacyl-tRNA synthetase multienzyme complex"	"GO:0005524///GO:0003723///GO:0004812///GO:0004819///GO:0016874///GO:0000166///GO:0019901"	"GO:0043066///GO:0006412"	"GO:0017101"
"1423712_a_at"	0.999848934610288	0.763873127515871	-0.305231257178581	-4.87816932413418	-0.0252649556446128	"Qars"	"glutaminyl-tRNA synthetase"	"97541"	"9"	"ATP binding///RNA binding///aminoacyl-tRNA ligase activity///glutamine-tRNA ligase activity///ligase activity///nucleotide binding///protein kinase binding"	"negative regulation of apoptotic process///translation"	"aminoacyl-tRNA synthetase multienzyme complex"	"GO:0005524///GO:0003723///GO:0004812///GO:0004819///GO:0016874///GO:0000166///GO:0019901"	"GO:0043066///GO:0006412"	"GO:0017101"
"1420461_at"	0.999848934610288	0.77045771514427	-0.296447491631663	-4.87943770437249	-0.0798623007624599	"Mst1r"	"macrophage stimulating 1 receptor (c-met-related tyrosine kinase)"	"19882"	"9 59.07 cM"	"ATP binding///enzyme binding///kinase activity///nucleotide binding///protein kinase activity///protein tyrosine kinase activity///receptor activity///transferase activity///transferase activity, transferring phosphorus-containing groups///transmembrane receptor protein tyrosine kinase activity"	"immune system process///innate immune response///multicellular organismal development///phosphorylation///positive regulation of MAP kinase activity///positive regulation of protein kinase B signaling///protein phosphorylation///response to virus///response to virus///transmembrane receptor protein tyrosine kinase signaling pathway///viral process"	"cell surface///integral component of membrane///membrane///plasma membrane///stress fiber"	"GO:0005524///GO:0019899///GO:0016301///GO:0000166///GO:0004672///GO:0004713///GO:0004872///GO:0016740///GO:0016772///GO:0004714"	"GO:0002376///GO:0045087///GO:0007275///GO:0016310///GO:0043406///GO:0051897///GO:0006468///GO:0009615///GO:0009615///GO:0007169///GO:0016032"	"GO:0009986///GO:0016021///GO:0016020///GO:0005886///GO:0001725"
"1441750_x_at"	0.999848934610288	0.777554530662076	0.287007291579377	-4.8807602265062	0.0274098492895315	"4930447F24Rik"	"RIKEN cDNA 4930447F24 gene"	"76873"	"9"	""	""	""	""	""	""
"1448679_at"	0.999848934610288	0.779895930124309	-0.283898701173014	-4.88118649644282	-0.0326039432439036	"Hyal2"	"hyaluronoglucosaminidase 2"	"15587"	"9 58.12 cM"	"contributes_to RNA polymerase II transcription coactivator activity///catalytic activity///enzyme binding///enzyme binding///hyaluronic acid binding///hyaluronic acid binding///hyaluronoglucuronidase activity///hyalurononglucosaminidase activity///hydrolase activity///hydrolase activity, acting on glycosyl bonds///receptor signaling protein tyrosine kinase inhibitor activity///receptor tyrosine kinase binding///transforming growth factor beta binding///virus receptor activity///NOT virus receptor activity"	"carbohydrate metabolic process///cellular response to UV-B///cellular response to fibroblast growth factor stimulus///cellular response to interleukin-1///cellular response to transforming growth factor beta stimulus///cellular response to transforming growth factor beta stimulus///defense response to virus///fusion of virus membrane with host plasma membrane///glycosaminoglycan catabolic process///hematopoietic progenitor cell differentiation///hyaluronan catabolic process///hyaluronan catabolic process///metabolic process///monocyte activation///monocyte activation///multicellular organismal aging///multicellular organismal iron ion homeostasis///negative regulation of MAP kinase activity///negative regulation of cell growth///negative regulation of fibroblast migration///negative regulation of protein kinase B signaling///negative regulation of protein tyrosine kinase activity///positive regulation of extrinsic apoptotic signaling pathway///positive regulation of extrinsic apoptotic signaling pathway///positive regulation of inflammatory response///positive regulation of inflammatory response///positive regulation of interleukin-6 secretion///positive regulation of interleukin-6 secretion///positive regulation of interleukin-8 secretion///positive regulation of interleukin-8 secretion///positive regulation of protein import into nucleus///positive regulation of transcription from RNA polymerase II promoter///response to reactive oxygen species///response to virus///response to virus///skeletal system morphogenesis///transformation of host cell by virus///viral entry into host cell"	"Golgi membrane///Golgi membrane///NOT anchored component of external side of plasma membrane///colocalizes_with anchored component of external side of plasma membrane///anchored component of membrane///anchored component of plasma membrane///anchored component of plasma membrane///apical plasma membrane///cell surface///cell surface///cytoplasm///cytoplasmic membrane-bounded vesicle///cytoplasmic vesicle///cytosol///endocytic vesicle///lysosome///membrane///membrane raft///membrane raft///microvillus///perinuclear region of cytoplasm///plasma membrane"	"contributes_to GO:0001105///GO:0003824///GO:0019899///GO:0019899///GO:0005540///GO:0005540///GO:0033906///GO:0004415///GO:0016787///GO:0016798///GO:0030294///GO:0030971///GO:0050431///GO:0001618///NOT GO:0001618"	"GO:0005975///GO:0071493///GO:0044344///GO:0071347///GO:0071560///GO:0071560///GO:0051607///GO:0019064///GO:0006027///GO:0002244///GO:0030214///GO:0030214///GO:0008152///GO:0042117///GO:0042117///GO:0010259///GO:0060586///GO:0043407///GO:0030308///GO:0010764///GO:0051898///GO:0061099///GO:2001238///GO:2001238///GO:0050729///GO:0050729///GO:2000778///GO:2000778///GO:2000484///GO:2000484///GO:0042307///GO:0045944///GO:0000302///GO:0009615///GO:0009615///GO:0048705///GO:0019087///GO:0046718"	"GO:0000139///GO:0000139///NOT GO:0031362///colocalizes_with GO:0031362///GO:0031225///GO:0046658///GO:0046658///GO:0016324///GO:0009986///GO:0009986///GO:0005737///GO:0016023///GO:0031410///GO:0005829///GO:0030139///GO:0005764///GO:0016020///GO:0045121///GO:0045121///GO:0005902///GO:0048471///GO:0005886"
"1453899_at"	0.999848934610288	0.79674438360081	-0.261612562497934	-4.88410840769691	-0.0206335440133615	"Rbm6"	"RNA binding motif protein 6"	"19654"	"9 F1-F2"	"poly(A) RNA binding"	""	"nucleus"	"GO:0044822"	""	"GO:0005634"
"1422968_at"	0.999848934610288	0.80008102721304	0.25721561623375	-4.88465704454197	0.0218365243180431	"Ip6k1"	"inositol hexaphosphate kinase 1"	"27399"	"9"	"ATP binding///inositol hexakisphosphate 1-kinase activity///inositol hexakisphosphate 3-kinase activity///inositol hexakisphosphate 5-kinase activity///inositol-1,4,5-trisphosphate 3-kinase activity///kinase activity///nucleotide binding///transferase activity"	"inositol metabolic process///inositol phosphate biosynthetic process///phosphatidylinositol phosphorylation///phosphorylation"	"cytoplasm///nucleolus///nucleus///nucleus"	"GO:0005524///GO:0052723///GO:0052724///GO:0000832///GO:0008440///GO:0016301///GO:0000166///GO:0016740"	"GO:0006020///GO:0032958///GO:0046854///GO:0016310"	"GO:0005737///GO:0005730///GO:0005634///GO:0005634"
"1426185_at"	0.999848934610288	0.80356373237054	0.252631778014837	-4.88521921744084	0.0244963420164197	"Cacna2d2"	"calcium channel, voltage-dependent, alpha 2/delta subunit 2"	"56808"	"9 58.02 cM"	"calcium channel activity///metal ion binding///voltage-gated calcium channel activity///voltage-gated calcium channel activity///voltage-gated ion channel activity"	"calcium ion transmembrane transport///calcium ion transport///calcium ion transport///ion transport///muscle fiber development///neuromuscular junction development///positive regulation of organ growth///regulation of ion transmembrane transport///regulation of multicellular organism growth///rhythmic synaptic transmission///transport"	"integral component of membrane///membrane///voltage-gated calcium channel complex"	"GO:0005262///GO:0046872///GO:0005245///GO:0005245///GO:0005244"	"GO:0070588///GO:0006816///GO:0006816///GO:0006811///GO:0048747///GO:0007528///GO:0046622///GO:0034765///GO:0040014///GO:0060024///GO:0006810"	"GO:0016021///GO:0016020///GO:0005891"
"1438142_s_at"	0.999848934610288	0.81341952836747	0.239689779696362	-4.88675249460308	0.0214089813206928	"Cdhr4"	"cadherin-related family member 4"	"69398"	"9"	"molecular_function"	"biological_process///cell adhesion"	"cellular_component///integral component of membrane///membrane"	"GO:0003674"	"GO:0008150///GO:0007155"	"GO:0005575///GO:0016021///GO:0016020"
"1453190_at"	0.999848934610288	0.819346092214211	-0.231927883509052	-4.88763379567276	-0.033000150302369	"Usp19"	"ubiquitin specific peptidase 19"	"71472"	"9"	"cysteine-type peptidase activity///hydrolase activity///metal ion binding///peptidase activity///ubiquitin-specific protease activity///ubiquitin-specific protease activity///ubiquitinyl hydrolase activity"	"ER-associated ubiquitin-dependent protein catabolic process///negative regulation of skeletal muscle tissue development///positive regulation of cell cycle process///protein deubiquitination///proteolysis///regulation of cellular response to hypoxia///regulation of protein stability///ubiquitin-dependent protein catabolic process"	"cytosol///endoplasmic reticulum///endoplasmic reticulum membrane///integral component of membrane///membrane"	"GO:0008234///GO:0016787///GO:0046872///GO:0008233///GO:0004843///GO:0004843///GO:0036459"	"GO:0030433///GO:0048642///GO:0090068///GO:0016579///GO:0006508///GO:1900037///GO:0031647///GO:0006511"	"GO:0005829///GO:0005783///GO:0005789///GO:0016021///GO:0016020"
